keys,fr
Text/50/text,"Bon travail aujourd'hui, pousse. N'oublie pas, l'efficacité est la clé. Nous avons des quotas à atteindre."
Text/51/text,"N'oublie pas de prendre ta ration de [wave amp=15 freq=2][color=DARK_VIOLET]Réserve Racine[/color][/wave]. Tu sais ce que dit la radio, c'est la saveur de l'avenir de Spud !"
Text/52/text,Une petite note glisse de quelques papiers sur ton bureau.
Text/53/text,"[color=GOLD]Tout n'est pas ce qu'il paraît. Les racines de notre nation sont pourries. [br] Suis la piste, mais prends garde à ne pas être réduit au silence.[/color] [br] - [color=CHARTREUSE]Un ami[/color]"
Text/54/text,Cette note... et la façon dont Russet a esquivé ma question sur [pulse freq=3][color=CRIMSON]les pommes de terre rejetées[/color][/pulse]... [br] Quelque chose semble [color=STEEL_BLUE]bizarre[/color].
Text/55/text,Je devrais rester [color=YELLOW]vigilant[/color]. Il y a plus ici que de tamponner des passeports.
