keys,el
Text/240/text,"Καθώς η βραδινή βάρδια τελειώνει, οι περισσότεροι αξιωματικοί έχουν φύγει. Μόνο εσύ και μια χούφτα φρουροί παραμένετε."
Text/241/text,Ένας ογκώδης φρουρός πλησιάζει το σταθμό σου. Το όνομά μου είναι Βίκτορ. Είμαι στη νυχτερινή φύλαξη.
Text/242/text,"Τα μάτια του είναι κουρασμένα, στοιχειωμένα. Είσαι ο καινούριος, έτσι; Αυτός που ο Ράσετ παρακολουθεί συνεχώς;"
Choice/243/text,Απλώς προσπαθώ να κάνω τη δουλειά μου. Γιατί με παρακολουθεί ο Ράσετ;
Choice/244/text,Υπάρχει κάτι που πρέπει να ξέρω;
Text/245/text,Ανασηκώνει βαριά τους ώμους. Ο Ράσετ παρακολουθεί όλους όσους κάνουν ερωτήσεις. Η [color=STEEL_BLUE]γυναίκα μου έκανε ερωτήσεις[/color] κάποτε.
Text/246/text,Δεν είναι πια εδώ για να ρωτάει.
Text/247/text,"Κοιτάζει γύρω του, μετά χαμηλώνει τη φωνή του. Απλώς... πρόσεχε ποιον εμπιστεύεσαι."
Text/248/text,Και ποιον [color=CRIMSON]καταδικάζεις[/color]. Κάποιοι από εμάς θυμόμαστε κάθε πρόσωπο που στείλαμε για επεξεργασία.
Text/249/text,"Μια νευρική πατάτα πλησιάζει. Τα χαρτιά φαίνονται εντάξει, αλλά παρατηρείς την [color=CHARTREUSE]διακριτική καρφίτσα φύλλου[/color] στο κολάρο τους."
Text/24a/text,"Γλιστρούν τα έγγραφά τους. Ένα μικρό σημείωμα είναι κρυμμένο μέσα: ""[color=CHARTREUSE]Η Σάσα με έστειλε. Πακέτο για το δίκτυο. Παρακαλώ.[/color]"""
Text/24b/text,Το νέο [color=DARK_ORANGE]RealityScan[/color] αναβοσβήνει έτοιμο στο σταθμό σου. Μία σάρωση και θα εντοπίσει πλαστά στοιχεία στα χαρτιά τους.
Choice/24c/text,Προσποιήσου ότι ο σαρωτής δυσλειτουργεί και άφησέ τους να περάσουν
Choice/24d/text,Χρησιμοποίησε τον σαρωτή όπως απαιτείται – δεν μπορείς να ρισκάρεις την έκθεση
Choice/24e/text,"Κάνε νόημα στον Βίκτορ να κοιτάξει αλλού, μετά άφησέ τους να περάσουν"
Text/24f/text,"Χτυπάς τον σαρωτή, συνοφρυώνεσαι, τον χτυπάς ξανά. ""Αυτό το καταραμένο πράγμα κάνει νερά. Πέρνα."""
Text/250/text,"Ανακούφιση πλημμυρίζει το πρόσωπό τους. Ψιθυρίζουν ""[color=CHARTREUSE]Ευχαριστώ[/color]"" και βιάζονται να περάσουν."
Text/251/text,"Τον κοιτάς στα μάτια και γνέφεις προς τον πράκτορα. Κοιτάζει αυτούς, μετά εσένα."
Text/252/text,"Γυρίζει επίτηδες την πλάτη του, μελετώντας τον τοίχο. ""[color=STEEL_BLUE]Ο σαρωτής έχει προβλήματα όλη μέρα.[/color]"""
Text/253/text,"Ο πράκτορας περνάει απαρατήρητος. Ο Βίκτορ δεν λέει τίποτα, αλλά έχετε μοιραστεί ένα μυστικό τώρα."
Text/254/text,"Εκτελείς τη σάρωση. Το μηχάνημα [color=RED]βρυχάται[/color]. ""Εντοπίστηκαν πλαστά έγγραφα."""
Text/255/text,"Τρόμος διαγράφεται στο πρόσωπό τους. ""[color=CRIMSON]Δεν καταλαβαίνεις τι έκανες...[/color]"""
Text/256/text,"Αυτός και άλλοι φρουροί πλησιάζουν. Ο πράκτορας σέρνεται μακριά, κοιτάζοντάς σε ακόμα."
Text/257/text,Η Σάσα σε πιάνει στις σκιές. Αυτός ο πράκτορας μετέφερε [color=CHARTREUSE]αντίγραφα των καταλόγων[/color] στους επαφές μας έξω.
Text/258/text,"Εξαιτίας σου, η αλήθεια θα εξαπλωθεί πέρα από τα σύνορα του Spud. [color=CHARTREUSE]Έκανες πραγματική διαφορά.[/color]"
Text/259/text,Τα μάτια της Σάσα ανοίγουν διάπλατα. Ο Βίκτορ βοήθησε; Είχα ένα προαίσθημα γι' αυτόν. Η γυναίκα του ήταν...
Text/25a/text,"Σταματάει να μιλάει. Έχουμε περισσότερους συμμάχους απ' ό,τι νόμιζα."
Text/25b/text,"Η Σάσα σε βρίσκει, με παγωμένη έκφραση. Αυτός ο πράκτορας είχε οικογένεια. Τρία βλαστάρια στο σπίτι."
Text/25c/text,Καταλαβαίνω τον φόβο. Αλλά [color=CRIMSON]ο φόβος έχει συνέπειες[/color]. Θα έχουν διεκπεραιωθεί μέχρι το πρωί.
Text/25d/text,Ελπίζω το καθαρό σου μητρώο να αξίζει τον κόπο.
Text/25e/text,Ο Μέρφι γλιστράει στα καταλύματά σου. Άκουσα ότι υπήρξε κάποια αναστάτωση στον σταθμό σου απόψε.
Text/25f/text,[color=CHARTREUSE]Καλώς. Είμαστε μαζί σε αυτό τώρα.[/color] Δεν υπάρχει γυρισμός.
Text/260/text,Το πρόσωπο του Μέρφι σκυθρωπιάζει. Εγώ... νόμιζα ότι ήσουν μαζί μας. Τι συνέβη;
Text/261/text,Η αυριανή βάρδια θα είναι διαφορετική. Το διακύβευμα δεν ήταν ποτέ μεγαλύτερο.
Text/262/text,"Αλλά για πρώτη φορά, νιώθεις ότι είσαι με τη [color=CHARTREUSE]σωστή πλευρά[/color]. Ό,τι κι αν κοστίσει."
Text/263/text,Το πρόσωπο του πράκτορα σε στοιχειώνει. Η οικογένειά του/της δεν θα μάθει ποτέ γιατί δεν γύρισε σπίτι.
Text/264/text,[color=STEEL_BLUE]Εξαιτίας σου.[/color]
Choice/243/disabled_text,
Choice/244/disabled_text,
Choice/24c/disabled_text,
Choice/24d/disabled_text,
Choice/24e/disabled_text,
