keys,th
Text/63/text,"สวัสดี, ฉันชื่อซาช่า. ยินดีต้อนรับสู่ทีม!"
Text/64/text,[wave amp=10 freq=2][color=YELLOW]และคอยจับตาดูให้ดี ไม่ใช่ทุกอย่างจะเป็นอย่างที่เห็นในสปัด[/color][/wave]
Text/65/text,ผู้สมัครคนต่อไปกำลังรออยู่ ตรวจสอบตราประทับเหล่านั้นอย่างละเอียด! หากพบ [color=YELLOW]พฤติกรรมที่น่าสงสัย[/color] ใด ๆ จะต้องถูกรายงาน
Text/66/text,จำไว้ว่า [color=DARK_ORANGE]เจ้าหน้าที่ผู้ซื่อสัตย์[/color] ไม่ต้องกลัวสิ่งใด ผู้ที่ละทิ้งหน้าที่คือผู้ที่ละทิ้งรากเหง้าของตน
Text/67/text,...ยอดการผลิตของ [pulse freq=2][color=DARK_VIOLET]รูทรีเสิร์ฟ[/color][/pulse] พุ่งสูงเป็นประวัติการณ์ อาหารมหัศจรรย์นี้ยังคงหล่อเลี้ยงชาติของเราต่อไป...
Text/68/text,ในข่าวอื่น ๆ รายงานเกี่ยวกับ [tornado radius=3 freq=2][color=CRIMSON]มันฝรั่งหายสาบสูญ[/color][/tornado] ยังคงมีมาอย่างต่อเนื่อง...
