keys,en,cs,da,de,es,fi,fr,hu,id,it,nl,no,pl,pt,ro,sk,sv,tr,vi
Text/16d/text,"You'll also receive a performance rating based on how well you processed potatoes during your shift, and up to 3 golden stamps if you exceed expectations.","Obdržíte také hodnocení výkonu založené na tom, jak dobře jste během své směny zpracovávali brambory, a až 3 zlatá razítka, pokud překonáte očekávání.","Du vil også modtage en præstationsvurdering baseret på, hvor godt du behandlede kartofler under dit skift, og op til 3 gyldne stempler, hvis du overgår forventningerne.","Sie erhalten auch eine Leistungsbewertung basierend darauf, wie gut Sie während Ihrer Schicht Kartoffeln bearbeitet haben, und bis zu 3 goldene Stempel, wenn Sie die Erwartungen übertreffen.","También recibirás una calificación de desempeño basada en qué tan bien procesaste las patatas durante tu turno, y hasta 3 sellos dorados si superas las expectativas.","Saat myös suoritusarvioinnin sen perusteella, kuinka hyvin käsittelit perunoita vuorosi aikana, ja jopa 3 kultaista leimaa, jos ylität odotukset.","Vous recevrez également une évaluation de performance basée sur la façon dont vous avez traité les pommes de terre pendant votre service, et jusqu'à 3 tampons dorés si vous dépassez les attentes.","Kap egy teljesítményértékelést is, amely azon alapul, hogy milyen jól dolgozta fel a burgonyákat a műszakja során, és akár 3 arany bélyegzőt is, ha túlteljesíti az elvárásokat.","Anda juga akan menerima peringkat kinerja berdasarkan seberapa baik Anda memproses kentang selama shift Anda, dan hingga 3 stempel emas jika Anda melebihi harapan.","Riceverai anche una valutazione delle prestazioni basata su quanto bene hai processato le patate durante il tuo turno, e fino a 3 timbri dorati se superi le aspettative.","Je ontvangt ook een prestatiebeoordeling op basis van hoe goed je aardappelen hebt verwerkt tijdens je dienst, en tot 3 gouden stempels als je de verwachtingen overtreft.","Du vil også motta en ytelsesvurdering basert på hvor godt du behandlet poteter under skiftet ditt, og opptil 3 gylne stempler hvis du overgår forventningene.","Otrzymasz również ocenę wydajności na podstawie tego, jak dobrze przetwarzałeś ziemniaki podczas swojej zmiany, i do 3 złotych pieczątek, jeśli przekroczysz oczekiwania.","Você também receberá uma classificação de desempenho com base em quão bem processou as batatas durante seu turno, e até 3 carimbos dourados se exceder as expectativas.","Veți primi, de asemenea, o evaluare a performanței pe baza calității procesării cartofilor în timpul turei dvs., și până la 3 ștampile de aur dacă depășiți așteptările.","Dostanete tiež hodnotenie výkonu založené na tom, ako dobre ste počas svojej zmeny spracovávali zemiaky, a až 3 zlaté pečiatky, ak prekročíte očakávania.","Du kommer också att få en prestationsbedömning baserad på hur väl du behandlade potatisar under ditt skift, och upp till 3 guldstämplar om du överträffar förväntningarna.",Vardiyamız sırasında patatesleri ne kadar iyi işlediğinize bağlı olarak bir performans değerlendirmesi ve beklentileri aşarsanız 3 altın damgaya kadar alacaksınız.,"Bạn cũng sẽ nhận được đánh giá hiệu suất dựa trên mức độ xử lý khoai tây tốt trong ca làm việc của mình, và lên đến 3 con dấu vàng nếu bạn vượt quá kỳ vọng."
Text/16e/text,Here you can submit your score for each shift to the global database of customs officers and see how you compare to the most elite customs officers around the world.,"Zde můžete odeslat své skóre za každou směnu do globální databáze celních úředníků a zjistit, jak si stojíte ve srovnání s nejlepšími celními úředníky po celém světě.","Her kan du indsende din score for hvert skift til den globale database over toldembedsmænd og se, hvordan du sammenligner med de mest elitære toldembedsmænd rundt om i verden.","Hier können Sie Ihre Punktzahl für jede Schicht in die globale Datenbank der Zollbeamten einreichen und sehen, wie Sie im Vergleich zu den Elite-Zollbeamten auf der ganzen Welt abschneiden.",Aquí puedes enviar tu puntuación de cada turno a la base de datos global de oficiales de aduanas y ver cómo te comparas con los oficiales de aduanas más élite de todo el mundo.,"Täällä voit lähettää pisteitäsi jokaiselta vuorolta tullitarkastajien maailmanlaajuiseen tietokantaan ja nähdä, miten vertaudut maailman huipputullitarkastajiin.","Ici, vous pouvez soumettre votre score pour chaque service à la base de données mondiale des agents des douanes et voir comment vous vous comparez aux agents des douanes les plus élites du monde entier.","Itt beküldheti pontszámát minden műszakról a vámtisztviselők globális adatbázisába, és megnézheti, hogyan hasonlít a világ legkiválóbb vámtisztviselőihez.",Di sini Anda dapat mengirimkan skor Anda untuk setiap shift ke database global petugas bea cukai dan melihat bagaimana Anda dibandingkan dengan petugas bea cukai paling elit di seluruh dunia.,Qui puoi inviare il tuo punteggio per ogni turno al database globale degli ufficiali doganali e vedere come ti confronti con gli ufficiali doganali più elite di tutto il mondo.,Hier kun je je score voor elke dienst indienen bij de wereldwijde database van douanebeambten en zien hoe je je verhoudt tot de meest elite douanebeambten over de hele wereld.,Her kan du sende inn poengsummen din for hvert skift til den globale databasen over tolltjenestemenn og se hvordan du sammenligner med de mest elitære tolltjenestemennene rundt om i verden.,"Tutaj możesz przesłać swój wynik za każdą zmianę do globalnej bazy danych funkcjonariuszy celnych i zobaczyć, jak wypadasz w porównaniu z najbardziej elitarnymi funkcjonariuszami celnymi na całym świecie.",Aqui você pode enviar sua pontuação para cada turno para o banco de dados global de oficiais aduaneiros e ver como se compara aos oficiais aduaneiros mais elite em todo o mundo.,Aici puteți trimite scorul dvs. pentru fiecare tură la baza de date globală a ofițerilor vamali și puteți vedea cum vă comparați cu cei mai de elită ofițeri vamali din întreaga lume.,"Tu môžete odoslať svoje skóre za každú zmenu do globálnej databázy colných úradníkov a zistiť, ako si stojíte v porovnaní s najlepšími colnými úradníkmi po celom svete.",Här kan du skicka in din poäng för varje skift till den globala databasen av tulltjänstemän och se hur du jämför med de mest elitära tulltjänstemännen runt om i världen.,Burada her vardiya için puanınızı gümrük memurlarının küresel veritabanına gönderebilir ve dünyadaki en elit gümrük memurlarıyla nasıl karşılaştırıldığınızı görebilirsiniz.,"Tại đây, bạn có thể gửi điểm số của mình cho mỗi ca làm việc vào cơ sở dữ liệu toàn cầu của các nhân viên hải quan và xem bạn so sánh như thế nào với các nhân viên hải quan ưu tú nhất trên toàn thế giới."
Text/16f/text,"If your shift was successful, you'll be able to move on by clicking ""Continue"" and starting your next shift.","Pokud byla vaše směna úspěšná, budete moci pokračovat kliknutím na ""Pokračovat"" a zahájením další směny.","Hvis dit skift var vellykket, vil du kunne fortsætte ved at klikke på ""Fortsæt"" og starte dit næste skift.","Wenn Ihre Schicht erfolgreich war, können Sie fortfahren, indem Sie auf ""Fortfahren"" klicken und Ihre nächste Schicht beginnen.","Si tu turno fue exitoso, podrás continuar haciendo clic en ""Continuar"" y comenzando tu próximo turno.","Jos vuorosi oli onnistunut, voit jatkaa napsauttamalla ""Jatka"" ja aloittamalla seuraavan vuorosi.","Si votre service a été réussi, vous pourrez continuer en cliquant sur ""Continuer"" et en commençant votre prochain service.","Ha a műszakja sikeres volt, folytathatja a ""Folytatás"" gombra kattintva és a következő műszakja megkezdésével.","Jika shift Anda berhasil, Anda akan dapat melanjutkan dengan mengklik ""Lanjutkan"" dan memulai shift berikutnya.","Se il tuo turno è stato un successo, potrai continuare cliccando su ""Continua"" e iniziando il tuo prossimo turno.","Als je dienst succesvol was, kun je doorgaan door op ""Doorgaan"" te klikken en je volgende dienst te starten.","Hvis skiftet ditt var vellykket, kan du fortsette ved å klikke på ""Fortsett"" og starte neste skift.","Jeśli Twoja zmiana zakończyła się sukcesem, będziesz mógł kontynuować, klikając ""Kontynuuj"" i rozpoczynając następną zmianę.","Se seu turno foi bem-sucedido, você poderá continuar clicando em ""Continuar"" e iniciando seu próximo turno.","Dacă tura dvs. a fost de succes, veți putea continua făcând clic pe ""Continuă"" și începând următoarea tură.","Ak bola vaša zmena úspešná, budete môcť pokračovať kliknutím na ""Pokračovať"" a začatím ďalšej zmeny.","Om ditt skift var framgångsrikt kommer du att kunna fortsätta genom att klicka på ""Fortsätt"" och starta ditt nästa skift.","Vardiyamız başarılı olduysa, ""Devam Et"" düğmesine tıklayarak ve bir sonraki vardiyamıza başlayarak devam edebilirsiniz.","Nếu ca làm việc của bạn thành công, bạn sẽ có thể tiếp tục bằng cách nhấp vào ""Tiếp tục"" và bắt đầu ca làm việc tiếp theo của mình."
Text/170/text,That covers the basics of your duties as a Customs Officer.,To pokrývá základy vašich povinností jako celního úředníka.,Det dækker grundlæggende for dine pligter som toldembedsmand.,Das deckt die Grundlagen Ihrer Pflichten als Zollbeamter ab.,Eso cubre los conceptos básicos de tus deberes como Oficial de Aduanas.,Tässä käsiteltiin tullitarkastajan velvollisuuksiesi perusteet.,Cela couvre les bases de vos devoirs en tant qu'agent des douanes.,Ez lefedi a vámtisztviselői kötelességeinek alapjait.,Itu mencakup dasar-dasar tugas Anda sebagai Petugas Bea Cukai.,Questo copre le basi dei tuoi doveri come Ufficiale Doganale.,Dit dekt de basis van je taken als Douanebeambte.,Det dekker det grunnleggende om pliktene dine som tolltjenestemann.,To obejmuje podstawy Twoich obowiązków jako funkcjonariusza celnego.,Isso cobre o básico de seus deveres como Oficial Aduaneiro.,Aceasta acoperă elementele de bază ale îndatoririlor dvs. ca Ofițer Vamal.,To pokrýva základy vašich povinností ako colného úradníka.,Det täcker grunderna i dina plikter som Tulltjänsteman.,"Bu, Gümrük Memuru olarak görevlerinizin temellerini kapsar.",Điều đó bao gồm những điều cơ bản về nhiệm vụ của bạn với tư cách là Nhân viên Hải quan.
Text/171/text,"Remember: check documents carefully, stop runners, and meet your quota.","Pamatujte: kontrolujte dokumenty pečlivě, zastavujte běžce a plňte svou kvótu.","Husk: tjek dokumenter omhyggeligt, stop løbere og opfyld din kvote.","Denken Sie daran: Überprüfen Sie Dokumente sorgfältig, stoppen Sie Ausreißer und erfüllen Sie Ihr Kontingent.","Recuerda: revisa los documentos cuidadosamente, detén a los corredores y cumple con tu cuota.","Muista: tarkista asiakirjat huolellisesti, pysäytä juoksijat ja täytä kiintiösi.","Souvenez-vous : vérifiez soigneusement les documents, arrêtez les coureurs et respectez votre quota.","Ne feledje: ellenőrizze gondosan a dokumentumokat, állítsa meg a futókat, és teljesítse a kvótáját.","Ingat: periksa dokumen dengan teliti, hentikan pelari, dan penuhi kuota Anda.","Ricorda: controlla attentamente i documenti, ferma i corridori e rispetta la tua quota.","Onthoud: controleer documenten zorgvuldig, stop renners en haal je quotum.","Husk: sjekk dokumenter nøye, stopp løpere og oppfyll kvoten din.","Pamiętaj: dokładnie sprawdzaj dokumenty, zatrzymuj biegaczy i spełniaj swój limit.","Lembre-se: verifique documentos cuidadosamente, pare corredores e cumpra sua cota.","Amintiți-vă: verificați documentele cu atenție, opriți fugarii și îndepliniți-vă cota.","Pamätajte: dôkladne kontrolujte dokumenty, zastavujte bežcov a plňte svoju kvótu.","Kom ihåg: kontrollera dokument noggrant, stoppa löpare och uppfyll din kvot.","Unutmayın: belgeleri dikkatle kontrol edin, koşucuları durdurun ve kotalarınızı doldurun.","Hãy nhớ: kiểm tra tài liệu cẩn thận, ngăn chặn người chạy trốn và đáp ứng hạn ngạch của bạn."
Text/172/text,The safety and security of Spud depends on your [pulse freq=2][color=DARK_ORANGE]vigilance![/color][/pulse],Bezpečnost Spudu závisí na vaší [pulse freq=2][color=DARK_ORANGE]bdělosti![/color][/pulse],Sikkerheden og trygheden for Spud afhænger af din [pulse freq=2][color=DARK_ORANGE]årvågenhed![/color][/pulse],Die Sicherheit von Spud hängt von Ihrer [pulse freq=2][color=DARK_ORANGE]Wachsamkeit ab![/color][/pulse],¡La seguridad de Spud depende de tu [pulse freq=2][color=DARK_ORANGE]vigilancia![/color][/pulse],Spudin turvallisuus riippuu [pulse freq=2][color=DARK_ORANGE]valppaudestasi![/color][/pulse],La sécurité de Spud dépend de votre [pulse freq=2][color=DARK_ORANGE]vigilance ![/color][/pulse],A Spud biztonsága az Ön [pulse freq=2][color=DARK_ORANGE]éberségén múlik![/color][/pulse],Keselamatan dan keamanan Spud bergantung pada [pulse freq=2][color=DARK_ORANGE]kewaspadaan Anda![/color][/pulse],La sicurezza di Spud dipende dalla tua [pulse freq=2][color=DARK_ORANGE]vigilanza![/color][/pulse],De veiligheid en beveiliging van Spud hangt af van je [pulse freq=2][color=DARK_ORANGE]waakzaamheid![/color][/pulse],Sikkerheten til Spud avhenger av din [pulse freq=2][color=DARK_ORANGE]årvåkenhet![/color][/pulse],Bezpieczeństwo Spud zależy od Twojej [pulse freq=2][color=DARK_ORANGE]czujności![/color][/pulse],A segurança de Spud depende da sua [pulse freq=2][color=DARK_ORANGE]vigilância![/color][/pulse],Siguranța și securitatea Spud depinde de [pulse freq=2][color=DARK_ORANGE]vigilența dvs.![/color][/pulse],Bezpečnosť Spudu závisí od vašej [pulse freq=2][color=DARK_ORANGE]ostražitosti![/color][/pulse],Säkerheten och tryggheten för Spud beror på din [pulse freq=2][color=DARK_ORANGE]vaksamhet![/color][/pulse],"Spud'un güvenliği, sizin [pulse freq=2][color=DARK_ORANGE]uyanıklığınıza bağlıdır![/color][/pulse]",An toàn và an ninh của Spud phụ thuộc vào [pulse freq=2][color=DARK_ORANGE]sự cảnh giác của bạn![/color][/pulse]
