keys,en,cs,da,de,es,fi,fr,hu,id,it,nl,no,pl,pt,ro,sk,sv,tr,uk,vi
Text/16c/text,"Plus any bonuses you earned from processing documents quickly, perfectly aligning stamps, or perfectly striking runner potatoes.","Plus jakékoli bonusy, které jste získali za rychlé zpracování dokumentů, perfektní zarovnání razítek nebo perfektní zasažení běžících brambor.","Plus eventuelle bonusser, du har optjent fra hurtig behandling af dokumenter, perfekt justering af stempler eller perfekt ramt løbende kartofler.","Plus alle Boni, die du durch schnelle Bearbeitung von Dokumenten, perfekte Ausrichtung von Stempeln oder perfektes Treffen von laufenden Kartoffeln verdient hast.","Además de cualquier bonificación que hayas ganado por procesar documentos rápidamente, alinear perfectamente los sellos o golpear perfectamente a las patatas corredoras.","Plus mahdolliset bonukset, jotka ansaitsit käsittelemällä asiakirjoja nopeasti, kohdistamalla leimat täydellisesti tai osumalla täydellisesti juokseviin perunoihin.","Plus tous les bonus que vous avez gagnés en traitant rapidement les documents, en alignant parfaitement les tampons ou en frappant parfaitement les pommes de terre en fuite.","Plusz bármilyen bónuszt, amit a dokumentumok gyors feldolgozásával, a bélyegzők tökéletes igazításával vagy a futó burgonyák tökéletes eltalálásával szerzett.","Ditambah bonus apa pun yang Anda peroleh dari memproses dokumen dengan cepat, menyejajarkan stempel dengan sempurna, atau mengenai kentang pelari dengan sempurna.","Più eventuali bonus guadagnati dall'elaborazione rapida dei documenti, dall'allineamento perfetto dei timbri o dal colpire perfettamente le patate fuggitive.","Plus eventuele bonussen die je hebt verdiend door documenten snel te verwerken, stempels perfect uit te lijnen of rennende aardappelen perfect te raken.","Pluss eventuelle bonuser du tjente ved å behandle dokumenter raskt, perfekt tilpasse stempler, eller perfekt treffe løpende poteter.","Plus wszelkie premie, które zarobiłeś dzięki szybkiemu przetwarzaniu dokumentów, idealnemu dopasowaniu pieczątek lub idealnemu trafianiu w uciekające ziemniaki.","Além de quaisquer bônus que ganhou por processar documentos rapidamente, alinhar perfeitamente os carimbos ou atingir perfeitamente batatas corredoras.","Plus orice bonusuri pe care le-ați câștigat din procesarea rapidă a documentelor, alinierea perfectă a ștampilelor sau lovirea perfectă a cartofilor fugari.","Plus akékoľvek bonusy, ktoré ste získali za rýchle spracovanie dokumentov, dokonalé zarovnanie pečiatok alebo dokonalé zasiahnutie utekajúcich zemiakov.","Plus eventuella bonusar du förtjänade genom att behandla dokument snabbt, perfekt rikta in stämplar eller perfekt träffa löpande potatisar.","Ayrıca belgeleri hızlı işlemek, damgaları mükemmel hizalamak veya kaçak patatesleri mükemmel vurmaktan kazandığınız bonuslar da vardır.","Плюс будь-які бонуси, які ви заробили за швидку обробку документів, ідеальне вирівнювання печаток або ідеальне ураження бігучої картоплі.","Cộng với bất kỳ phần thưởng nào bạn kiếm được từ việc xử lý giấy tờ nhanh chóng, căn chỉnh con dấu hoàn hảo, hoặc bắn trúng khoai tây chạy trốn một cách hoàn hảo."
Text/16d/text,"You'll also receive a performance rating based on how well you processed potatoes during your shift, and up to 3 golden stamps if you exceed expectations.","Také obdržíte hodnocení výkonu založené na tom, jak dobře jste zpracovali brambory během vaší směny, a až 3 zlatá razítka, pokud překonáte očekávání.","Du vil også modtage en præstationsvurdering baseret på, hvor godt du behandlede kartofler under dit skift, og op til 3 gyldne stempler, hvis du overgår forventningerne.","Du erhältst auch eine Leistungsbewertung basierend darauf, wie gut du Kartoffeln während deiner Schicht bearbeitet hast, und bis zu 3 goldene Stempel, wenn du die Erwartungen übertriffst.","También recibirás una calificación de desempeño basada en qué tan bien procesaste las patatas durante tu turno, y hasta 3 sellos dorados si superas las expectativas.","Saat myös suoritusarvioinnin sen perusteella, kuinka hyvin käsittelit perunoita vuorosi aikana, ja jopa 3 kultaista leimaa, jos ylität odotukset.","Vous recevrez également une évaluation de performance basée sur la qualité de votre traitement des pommes de terre pendant votre service, et jusqu'à 3 tampons dorés si vous dépassez les attentes.","Teljesítményértékelést is kap annak alapján, hogy mennyire jól dolgozta fel a burgonyákat a műszakja során, és akár 3 arany bélyegzőt is kaphat, ha túlteljesíti az elvárásokat.","Anda juga akan menerima peringkat kinerja berdasarkan seberapa baik Anda memproses kentang selama shift Anda, dan hingga 3 stempel emas jika Anda melebihi harapan.","Riceverai anche una valutazione delle prestazioni basata su quanto bene hai processato le patate durante il tuo turno, e fino a 3 timbri d'oro se superi le aspettative.","Je ontvangt ook een prestatiewaardering op basis van hoe goed je aardappelen hebt verwerkt tijdens je dienst, en tot 3 gouden stempels als je de verwachtingen overtreft.","Du vil også motta en ytelsesrangering basert på hvor godt du behandlet poteter under skiftet ditt, og opptil 3 gylne stempler hvis du overgår forventningene.","Otrzymasz również ocenę wydajności opartą na tym, jak dobrze przetwarzałeś ziemniaki podczas swojej zmiany, i do 3 złotych pieczątek, jeśli przekroczysz oczekiwania.","Você também receberá uma classificação de desempenho com base em quão bem processou as batatas durante seu turno, e até 3 carimbos dourados se exceder as expectativas.","Veți primi, de asemenea, o evaluare a performanței bazată pe cât de bine ați procesat cartofii în timpul turei dumneavoastră și până la 3 ștampile aurii dacă depășiți așteptările.","Dostanete tiež hodnotenie výkonnosti na základe toho, ako dobre ste spracovali zemiaky počas vašej zmeny, a až 3 zlaté pečiatky, ak prekročíte očakávania.","Du kommer också att få en prestationsbedömning baserad på hur väl du behandlade potatisar under ditt skift, och upp till 3 guldstämplar om du överträffar förväntningarna.",Vardiyenız sırasında patatesleri ne kadar iyi işlediğinize bağlı olarak bir performans derecesi ve beklentileri aşarsanız 3 altın damgaya kadar alacaksınız.,"Ви також отримаєте оцінку продуктивності, засновану на тому, наскільки добре ви обробляли картоплю під час вашої зміни, і до 3 золотих печаток, якщо перевершите очікування.","Bạn cũng sẽ nhận được đánh giá hiệu suất dựa trên mức độ tốt bạn xử lý khoai tây trong ca trực của mình, và tối đa 3 con dấu vàng nếu bạn vượt quá mong đợi."
Text/16e/text,Here you can submit your score for each shift to the global database of customs officers and see how you compare to the most elite customs officers around the world.,"Zde můžete odeslat své skóre za každou směnu do globální databáze celních úředníků a zjistit, jak si vedete ve srovnání s nejlepšími celními úředníky po celém světě.","Her kan du indsende din score for hvert skift til den globale database over toldembedsmænd og se, hvordan du sammenligner med de mest elitære toldembedsmænd rundt om i verden.","Hier kannst du deine Punktzahl für jede Schicht an die globale Datenbank der Zollbeamten übermitteln und sehen, wie du im Vergleich zu den elitärsten Zollbeamten auf der ganzen Welt abschneidest.",Aquí puedes enviar tu puntuación de cada turno a la base de datos global de oficiales de aduanas y ver cómo te comparas con los oficiales de aduanas más élite de todo el mundo.,"Täällä voit lähettää pisteesi jokaisesta vuorosta tullitarkastajien maailmanlaajuiseen tietokantaan ja nähdä, miten vertaudut maailman eliittitullitarkastajiin.","Ici, vous pouvez soumettre votre score pour chaque service à la base de données mondiale des agents des douanes et voir comment vous vous comparez aux agents des douanes les plus élites du monde entier.","Itt benyújthatja pontszámát minden műszakért a vámtisztviselők globális adatbázisába, és láthatja, hogyan hasonlít a világ legelitebb vámtisztviselőihez.",Di sini Anda dapat mengirimkan skor Anda untuk setiap shift ke database global petugas bea cukai dan melihat bagaimana Anda dibandingkan dengan petugas bea cukai paling elit di seluruh dunia.,Qui puoi inviare il tuo punteggio per ogni turno al database globale degli ufficiali doganali e vedere come ti confronti con gli ufficiali doganali più d'élite di tutto il mondo.,Hier kun je je score voor elke dienst indienen bij de wereldwijde database van douanebeambten en zien hoe je je verhoudt tot de meest elite douanebeambten over de hele wereld.,Her kan du sende inn poengsummen din for hvert skift til den globale databasen over tolloffiserer og se hvordan du sammenligner med de mest elitære tolloffiserene rundt om i verden.,"Tutaj możesz przesłać swój wynik za każdą zmianę do globalnej bazy danych funkcjonariuszy celnych i zobaczyć, jak wypadasz na tle najbardziej elitarnych funkcjonariuszy celnych na całym świecie.",Aqui você pode enviar sua pontuação para cada turno ao banco de dados global de oficiais alfandegários e ver como se compara aos oficiais alfandegários mais elite ao redor do mundo.,Aici puteți trimite scorul dumneavoastră pentru fiecare tură în baza de date globală a ofițerilor vamali și puteți vedea cum vă comparați cu cei mai de elită ofițeri vamali din întreaga lume.,"Tu môžete odoslať svoje skóre za každú zmenu do globálnej databázy colných dôstojníkov a pozrieť sa, ako sa porovnávate s najelitnejšími colnými dôstojníkmi po celom svete.",Här kan du skicka in din poäng för varje skift till den globala databasen över tulltjänstemän och se hur du jämför med de mest elitära tulltjänstemännen runt om i världen.,Burada her vardiya için puanınızı gümrük memurlarının küresel veritabanına gönderebilir ve dünyanın dört bir yanındaki en elit gümrük memurlarıyla nasıl karşılaştırıldığınızı görebilirsiniz.,"Тут ви можете відправити свій рахунок за кожну зміну до глобальної бази даних митних офіцерів і побачити, як ви порівнюєтесь з найелітнішими митними офіцерами по всьому світу.",Ở đây bạn có thể gửi điểm số của mình cho mỗi ca trực vào cơ sở dữ liệu toàn cầu của nhân viên hải quan và xem bạn so sánh như thế nào với các nhân viên hải quan ưu tú nhất trên toàn thế giới.
Text/16f/text,"If your shift was successful, you'll be able to move on by clicking ""Continue"" and starting your next shift.","Pokud byla vaše směna úspěšná, budete moci pokračovat kliknutím na ""Pokračovat"" a zahájením další směny.","Hvis dit skift var vellykket, vil du kunne gå videre ved at klikke på ""Fortsæt"" og starte dit næste skift.","Wenn deine Schicht erfolgreich war, kannst du fortfahren, indem du auf ""Fortsetzen"" klickst und deine nächste Schicht beginnst.","Si tu turno fue exitoso, podrás continuar haciendo clic en ""Continuar"" y comenzando tu próximo turno.","Jos vuorosi oli onnistunut, voit jatkaa napsauttamalla ""Jatka"" ja aloittaa seuraavan vuorosi.","Si votre service a été réussi, vous pourrez continuer en cliquant sur ""Continuer"" et commencer votre prochain service.","Ha a műszakja sikeres volt, továbbléphet a ""Folytatás"" gombra kattintva és elkezdheti a következő műszakját.","Jika shift Anda berhasil, Anda akan dapat melanjutkan dengan mengklik ""Lanjutkan"" dan memulai shift berikutnya.","Se il tuo turno è stato di successo, potrai andare avanti cliccando su ""Continua"" e iniziando il tuo prossimo turno.","Als je dienst succesvol was, kun je verder gaan door op ""Doorgaan"" te klikken en je volgende dienst te beginnen.","Hvis skiftet ditt var vellykket, vil du kunne gå videre ved å klikke ""Fortsett"" og starte neste skift.","Jeśli twoja zmiana była udana, będziesz mógł przejść dalej, klikając ""Kontynuuj"" i rozpoczynając następną zmianę.","Se seu turno foi bem-sucedido, você poderá seguir em frente clicando em ""Continuar"" e iniciando seu próximo turno.","Dacă tura dumneavoastră a fost de succes, veți putea continua făcând clic pe ""Continuă"" și începând următoarea tură.","Ak bola vaša zmena úspešná, budete môcť pokračovať kliknutím na ""Pokračovať"" a začať vašu ďalšiu zmenu.","Om ditt skift var framgångsrikt kommer du att kunna gå vidare genom att klicka på ""Fortsätt"" och starta ditt nästa skift.","Vardiyeniz başarılı olursa, ""Devam Et"" düğmesine tıklayarak ve bir sonraki vardiyenıza başlayarak ilerleyebilirsiniz.","Якщо ваша зміна була успішною, ви зможете продовжити, натиснувши ""Продовжити"" і почавши свою наступну зміну.","Nếu ca trực của bạn thành công, bạn sẽ có thể tiếp tục bằng cách nhấp vào ""Tiếp tục"" và bắt đầu ca trực tiếp theo của mình."
Text/170/text,That covers the basics of your duties as a Customs Officer.,To pokrývá základy vašich povinností jako celního úředníka.,Det dækker det grundlæggende om dine pligter som toldembedsmand.,Das deckt die Grundlagen deiner Pflichten als Zollbeamter ab.,Eso cubre los conceptos básicos de tus deberes como Oficial de Aduanas.,Tämä kattaa perusasiat velvollisuuksistasi tullivirkailijana.,Cela couvre les bases de vos devoirs en tant qu'Agent des Douanes.,Ez lefedi a vámtisztviselőként végzett kötelességeinek alapjait.,Itu mencakup dasar-dasar tugas Anda sebagai Petugas Bea Cukai.,Questo copre le basi dei tuoi doveri come Ufficiale Doganale.,Dat dekt de basis van je taken als Douanebeambte.,Det dekker det grunnleggende om dine plikter som Tolloffiser.,To obejmuje podstawy twoich obowiązków jako Funkcjonariusza Celnego.,Isso cobre o básico de seus deveres como Oficial Alfandegário.,Acestea acoperă elementele de bază ale îndatoririlor dumneavoastră ca Ofițer Vamal.,To pokrýva základy vašich povinností ako Colného dôstojníka.,Det täcker grunderna i dina uppgifter som Tulltjänsteman.,"Bu, Gümrük Memuru olarak görevlerinizin temellerini kapsar.",Це охоплює основи ваших обов'язків у якості Митного Офіцера.,Điều đó bao gồm các kiến thức cơ bản về nhiệm vụ của bạn với tư cách là Nhân viên Hải quan.
Text/171/text,"Remember: check documents carefully, stop runners, and meet your quota.","Pamatujte: pečlivě kontrolujte dokumenty, zastavujte běžce a plňte svou kvótu.","Husk: tjek dokumenter omhyggeligt, stop løbere og opfyld din kvote.","Denke daran: Prüfe Dokumente sorgfältig, stoppe Läufer und erfülle deine Quote.","Recuerda: revisa los documentos cuidadosamente, detén a los corredores y cumple con tu cuota.","Muista: tarkista asiakirjat huolellisesti, pysäytä juoksijat ja täytä kiintiösi.","Souvenez-vous : vérifiez soigneusement les documents, arrêtez les coureurs et respectez votre quota.","Ne feledje: ellenőrizze gondosan a dokumentumokat, állítsa meg a futókat és teljesítse a kvótáját.","Ingat: periksa dokumen dengan cermat, hentikan pelari, dan penuhi kuota Anda.","Ricorda: controlla attentamente i documenti, ferma i fuggitivi e soddisfa la tua quota.","Onthoud: controleer documenten zorgvuldig, stop renners en haal je quotum.","Husk: sjekk dokumenter nøye, stopp løpere, og møt kvoten din.","Pamiętaj: dokładnie sprawdzaj dokumenty, zatrzymuj uciekinierów i spełniaj swoje normy.","Lembre-se: verifique documentos cuidadosamente, pare corredores e cumpra sua cota.","Amintiți-vă: verificați documentele cu atenție, opriți fugarii și îndepliniți-vă cota.","Pamätajte: dôkladne kontrolujte dokumenty, zastavujte bežcov a plňte svoju kvótu.","Kom ihåg: kontrollera dokument noggrant, stoppa löpare och uppfyll din kvot.","Unutmayın: belgeleri dikkatle kontrol edin, kaçakları durdurun ve kotanızı doldurun.","Пам'ятайте: ретельно перевіряйте документи, зупиняйте бігунів і виконуйте свою квоту.","Hãy nhớ: kiểm tra giấy tờ cẩn thận, ngăn chặn những kẻ chạy trốn, và đạt định mức của bạn."
Text/172/text,The safety and security of Spud depends on your [pulse freq=2][color=DARK_ORANGE]vigilance![/color][/pulse],Bezpečnost a zabezpečení Spudu závisí na vaší [pulse freq=2][color=DARK_ORANGE]bdělosti![/color][/pulse],Spuds sikkerhed og tryghed afhænger af din [pulse freq=2][color=DARK_ORANGE]årvågenhed![/color][/pulse],Die Sicherheit und der Schutz von Spud hängt von deiner [pulse freq=2][color=DARK_ORANGE]Wachsamkeit ab![/color][/pulse],¡La seguridad y protección de Spud depende de tu [pulse freq=2][color=DARK_ORANGE]vigilancia![/color][/pulse],Spudin turvallisuus riippuu [pulse freq=2][color=DARK_ORANGE]valppaudestasi![/color][/pulse],La sécurité et la protection de Spud dépendent de votre [pulse freq=2][color=DARK_ORANGE]vigilance ![/color][/pulse],Spud biztonsága és védelme az Ön [pulse freq=2][color=DARK_ORANGE]éberségén múlik![/color][/pulse],Keselamatan dan keamanan Spud bergantung pada [pulse freq=2][color=DARK_ORANGE]kewaspadaan Anda![/color][/pulse],La sicurezza e la protezione di Spud dipendono dalla tua [pulse freq=2][color=DARK_ORANGE]vigilanza![/color][/pulse],De veiligheid en beveiliging van Spud hangt af van jouw [pulse freq=2][color=DARK_ORANGE]waakzaamheid![/color][/pulse],Sikkerheten til Spud avhenger av din [pulse freq=2][color=DARK_ORANGE]årvåkenhet![/color][/pulse],Bezpieczeństwo Spud zależy od twojej [pulse freq=2][color=DARK_ORANGE]czujności![/color][/pulse],A segurança de Spud depende da sua [pulse freq=2][color=DARK_ORANGE]vigilância![/color][/pulse],Siguranța și securitatea Spud depind de [pulse freq=2][color=DARK_ORANGE]vigilența dumneavoastră![/color][/pulse],Bezpečnosť a ochrana Spud závisí od vašej [pulse freq=2][color=DARK_ORANGE]ostražitosti![/color][/pulse],Spuds säkerhet och trygghet beror på din [pulse freq=2][color=DARK_ORANGE]vaksamhet![/color][/pulse],Spud'un güvenliği ve emniyeti sizin [pulse freq=2][color=DARK_ORANGE]dikkatinize[/color][/pulse] bağlıdır!,Безпека та захист Spud залежить від вашої [pulse freq=2][color=DARK_ORANGE]пильності![/color][/pulse],Sự an toàn và an ninh của Spud phụ thuộc vào [pulse freq=2][color=DARK_ORANGE]sự cảnh giác của bạn![/color][/pulse]
