Text/1a_rescue11/text,Now let's make them pay for everyone they've taken. [color=CHARTREUSE]Together.[/color],,,,,,,,,,,,,,,,,,,Now let's make them pay for everyone they've taken. [color=CHARTREUSE]Together.[/color],Now let's make them pay for everyone they've taken. [color=CHARTREUSE]Together.[/color],Now let's make them pay for everyone they've taken. [color=CHARTREUSE]Together.[/color],Now let's make them pay for everyone they've taken. [color=CHARTREUSE]Together.[/color],Now let's make them pay for everyone they've taken. [color=CHARTREUSE]Together.[/color],Now let's make them pay for everyone they've taken. [color=CHARTREUSE]Together.[/color],Now let's make them pay for everyone they've taken. [color=CHARTREUSE]Together.[/color],Now let's make them pay for everyone they've taken. [color=CHARTREUSE]Together.[/color],Now let's make them pay for everyone they've taken. [color=CHARTREUSE]Together.[/color],Now let's make them pay for everyone they've taken. [color=CHARTREUSE]Together.[/color],Now let's make them pay for everyone they've taken. [color=CHARTREUSE]Together.[/color],Now let's make them pay for everyone they've taken. [color=CHARTREUSE]Together.[/color]
Text/1a_rescue12/text,Sasha manages a weak smile through her pain. [color=STEEL_BLUE]I'll try.[/color] But some things are worth the risk.,,,,,,,,,,,,,,,,,,,Sasha manages a weak smile through her pain. [color=STEEL_BLUE]I'll try.[/color] But some things are worth the risk.,Sasha manages a weak smile through her pain. [color=STEEL_BLUE]I'll try.[/color] But some things are worth the risk.,Sasha manages a weak smile through her pain. [color=STEEL_BLUE]I'll try.[/color] But some things are worth the risk.,Sasha manages a weak smile through her pain. [color=STEEL_BLUE]I'll try.[/color] But some things are worth the risk.,Sasha manages a weak smile through her pain. [color=STEEL_BLUE]I'll try.[/color] But some things are worth the risk.,Sasha manages a weak smile through her pain. [color=STEEL_BLUE]I'll try.[/color] But some things are worth the risk.,Sasha manages a weak smile through her pain. [color=STEEL_BLUE]I'll try.[/color] But some things are worth the risk.,Sasha manages a weak smile through her pain. [color=STEEL_BLUE]I'll try.[/color] But some things are worth the risk.,Sasha manages a weak smile through her pain. [color=STEEL_BLUE]I'll try.[/color] But some things are worth the risk.,Sasha manages a weak smile through her pain. [color=STEEL_BLUE]I'll try.[/color] But some things are worth the risk.,Sasha manages a weak smile through her pain. [color=STEEL_BLUE]I'll try.[/color] But some things are worth the risk.,Sasha manages a weak smile through her pain. [color=STEEL_BLUE]I'll try.[/color] But some things are worth the risk.
Text/1a_rescue13/text,You being here proves that. Now let's finish this.,,,,,,,,,,,,,,,,,,,You being here proves that. Now let's finish this.,You being here proves that. Now let's finish this.,You being here proves that. Now let's finish this.,You being here proves that. Now let's finish this.,You being here proves that. Now let's finish this.,You being here proves that. Now let's finish this.,You being here proves that. Now let's finish this.,You being here proves that. Now let's finish this.,You being here proves that. Now let's finish this.,You being here proves that. Now let's finish this.,You being here proves that. Now let's finish this.,You being here proves that. Now let's finish this.
Text/1a_rescue14/text,"Sasha nods, her determination rekindled. [color=CHARTREUSE]You're right.[/color] Sentiment can wait.",,,,,,,,,,,,,,,,,,,"Sasha nods, her determination rekindled. [color=CHARTREUSE]You're right.[/color] Sentiment can wait.","Sasha nods, her determination rekindled. [color=CHARTREUSE]You're right.[/color] Sentiment can wait.","Sasha nods, her determination rekindled. [color=CHARTREUSE]You're right.[/color] Sentiment can wait.","Sasha nods, her determination rekindled. [color=CHARTREUSE]You're right.[/color] Sentiment can wait.","Sasha nods, her determination rekindled. [color=CHARTREUSE]You're right.[/color] Sentiment can wait.","Sasha nods, her determination rekindled. [color=CHARTREUSE]You're right.[/color] Sentiment can wait.","Sasha nods, her determination rekindled. [color=CHARTREUSE]You're right.[/color] Sentiment can wait.","Sasha nods, her determination rekindled. [color=CHARTREUSE]You're right.[/color] Sentiment can wait.","Sasha nods, her determination rekindled. [color=CHARTREUSE]You're right.[/color] Sentiment can wait.","Sasha nods, her determination rekindled. [color=CHARTREUSE]You're right.[/color] Sentiment can wait.","Sasha nods, her determination rekindled. [color=CHARTREUSE]You're right.[/color] Sentiment can wait.","Sasha nods, her determination rekindled. [color=CHARTREUSE]You're right.[/color] Sentiment can wait."
Text/1a_rescue15/text,Idaho thinks he's won. Let's show him how wrong he is.,,,,,,,,,,,,,,,,,,,Idaho thinks he's won. Let's show him how wrong he is.,Idaho thinks he's won. Let's show him how wrong he is.,Idaho thinks he's won. Let's show him how wrong he is.,Idaho thinks he's won. Let's show him how wrong he is.,Idaho thinks he's won. Let's show him how wrong he is.,Idaho thinks he's won. Let's show him how wrong he is.,Idaho thinks he's won. Let's show him how wrong he is.,Idaho thinks he's won. Let's show him how wrong he is.,Idaho thinks he's won. Let's show him how wrong he is.,Idaho thinks he's won. Let's show him how wrong he is.,Idaho thinks he's won. Let's show him how wrong he is.,Idaho thinks he's won. Let's show him how wrong he is.
Text/1a/text,"After a tense infiltration, your team stands at the heart of [color=DARK_VIOLET]Root Reserve[/color], the [pulse freq=3][color=CRIMSON]horrific machinery of oppression[/color][/pulse] laid bare.","Po napjatém proniknutí stojí váš tým v srdci [color=DARK_VIOLET]Kořenové Rezervy[/color], [pulse freq=3][color=CRIMSON]hrůzné mašinérie útlaku[/color][/pulse] odhalené.","Efter en anspændt infiltration står dit team i hjertet af [color=DARK_VIOLET]Rod Reservatet[/color], det [pulse freq=3][color=CRIMSON]forfærdelige undertrykkelsesmaskineri[/color][/pulse] blotlagt.","Nach einer angespannten Infiltration steht dein Team im Herzen der [color=DARK_VIOLET]Wurzelreserve[/color], die [pulse freq=3][color=CRIMSON]schreckliche Maschinerie der Unterdrückung[/color][/pulse] liegt offen.","Después de una tensa infiltración, tu equipo se encuentra en el corazón de la [color=DARK_VIOLET]Reserva Raíz[/color], la [pulse freq=3][color=CRIMSON]horrorosa maquinaria de opresión[/color][/pulse] al descubierto.","Jännittyneen soluttautumisen jälkeen tiiminne seisoo [color=DARK_VIOLET]Juurivaraston[/color] sydämessä, [pulse freq=3][color=CRIMSON]kauhea sorron koneisto[/color][/pulse] paljaana.","Après une infiltration tendue, votre équipe se tient au cœur de la [color=DARK_VIOLET]Réserve Racine[/color], la [pulse freq=3][color=CRIMSON]terrible machinerie d'oppression[/color][/pulse] mise à nu.","Egy feszült beszivárgás után csapatod a [color=DARK_VIOLET]Gyökértartalék[/color] szívében áll, az [pulse freq=3][color=CRIMSON]elnyomás szörnyű gépezetét[/color][/pulse] felfedve.","Setelah penyusupan yang menegangkan, timmu berdiri di jantung [color=DARK_VIOLET]Cadangan Akar[/color], [pulse freq=3][color=CRIMSON]mesin penindasan yang mengerikan[/color][/pulse] terlihat jelas.","Dopo un'infiltrazione tesa, la tua squadra si trova nel cuore della [color=DARK_VIOLET]Riserva Radice[/color], il [pulse freq=3][color=CRIMSON]terribile macchinario dell'oppressione[/color][/pulse] messo a nudo.","Na een gespannen infiltratie staat je team in het hart van de [color=DARK_VIOLET]Wortelreserve[/color], de [pulse freq=3][color=CRIMSON]gruwelijke machinerie van onderdrukking[/color][/pulse] blootgelegd.","Etter en spent infiltrasjon står teamet ditt i hjertet av [color=DARK_VIOLET]Rotreserven[/color], det [pulse freq=3][color=CRIMSON]forferdelige maskineriet av undertrykkelse[/color][/pulse] blottlagt.","Po napiętej infiltracji twój zespół stoi w sercu [color=DARK_VIOLET]Korzeniowej Rezerwy[/color], [pulse freq=3][color=CRIMSON]przerażająca maszyneria opresji[/color][/pulse] obnażona.","Após uma infiltração tensa, sua equipe está no coração da [color=DARK_VIOLET]Reserva Raiz[/color], a [pulse freq=3][color=CRIMSON]horrível maquinaria de opressão[/color][/pulse] exposta.","După o infiltrare tensionată, echipa ta stă în inima [color=DARK_VIOLET]Rezervei Rădăcină[/color], [pulse freq=3][color=CRIMSON]îngrozitoarea mașinărie a opresiunii[/color][/pulse] expusă.","Po napätej infiltrácii stojí váš tím v srdci [color=DARK_VIOLET]Koreňovej Rezervy[/color], [pulse freq=3][color=CRIMSON]desivá mašinéria útlaku[/color][/pulse] odhalená.","Efter en spänd infiltration står ditt team i hjärtat av [color=DARK_VIOLET]Rotreservatet[/color], det [pulse freq=3][color=CRIMSON]fruktansvärda förtryckets maskineri[/color][/pulse] blottlagt.","Gergin bir sızma sonrası, ekibin [color=DARK_VIOLET]Kök Rezervi'nin[/color] kalbinde duruyor, [pulse freq=3][color=CRIMSON]korkunç baskı makinesi[/color][/pulse] açığa çıkarılmış.","Sau cuộc xâm nhập căng thẳng, đội của bạn đứng tại trung tâm của [color=DARK_VIOLET]Kho Dự Trữ Rễ[/color], [pulse freq=3][color=CRIMSON]bộ máy đàn áp kinh hoàng[/color][/pulse] bị phơi bày.","After a tense infiltration, your team stands at the heart of [color=DARK_VIOLET]Root Reserve[/color], the [pulse freq=3][color=CRIMSON]horrific machinery of oppression[/color][/pulse] laid bare.","After a tense infiltration, your team stands at the heart of [color=DARK_VIOLET]Root Reserve[/color], the [pulse freq=3][color=CRIMSON]horrific machinery of oppression[/color][/pulse] laid bare.","After a tense infiltration, your team stands at the heart of [color=DARK_VIOLET]Root Reserve[/color], the [pulse freq=3][color=CRIMSON]horrific machinery of oppression[/color][/pulse] laid bare.","After a tense infiltration, your team stands at the heart of [color=DARK_VIOLET]Root Reserve[/color], the [pulse freq=3][color=CRIMSON]horrific machinery of oppression[/color][/pulse] laid bare.","After a tense infiltration, your team stands at the heart of [color=DARK_VIOLET]Root Reserve[/color], the [pulse freq=3][color=CRIMSON]horrific machinery of oppression[/color][/pulse] laid bare.","After a tense infiltration, your team stands at the heart of [color=DARK_VIOLET]Root Reserve[/color], the [pulse freq=3][color=CRIMSON]horrific machinery of oppression[/color][/pulse] laid bare.","After a tense infiltration, your team stands at the heart of [color=DARK_VIOLET]Root Reserve[/color], the [pulse freq=3][color=CRIMSON]horrific machinery of oppression[/color][/pulse] laid bare.","After a tense infiltration, your team stands at the heart of [color=DARK_VIOLET]Root Reserve[/color], the [pulse freq=3][color=CRIMSON]horrific machinery of oppression[/color][/pulse] laid bare.","After a tense infiltration, your team stands at the heart of [color=DARK_VIOLET]Root Reserve[/color], the [pulse freq=3][color=CRIMSON]horrific machinery of oppression[/color][/pulse] laid bare.","After a tense infiltration, your team stands at the heart of [color=DARK_VIOLET]Root Reserve[/color], the [pulse freq=3][color=CRIMSON]horrific machinery of oppression[/color][/pulse] laid bare.","After a tense infiltration, your team stands at the heart of [color=DARK_VIOLET]Root Reserve[/color], the [pulse freq=3][color=CRIMSON]horrific machinery of oppression[/color][/pulse] laid bare.","After a tense infiltration, your team stands at the heart of [color=DARK_VIOLET]Root Reserve[/color], the [pulse freq=3][color=CRIMSON]horrific machinery of oppression[/color][/pulse] laid bare."
Text/1b/text,"[wave amp=25 freq=3][color=RED]Alarms blare[/color][/wave] as guards scramble to respond to your intrusion. You race through corridors, dodging security systems.","[wave amp=25 freq=3][color=RED]Alarmy kvílí[/color][/wave] zatímco stráže spěchají reagovat na váš průnik. Proháníte se chodbami, vyhýbáte se bezpečnostním systémům.","[wave amp=25 freq=3][color=RED]Alarmer hyler[/color][/wave] mens vagter skynder sig at reagere på jeres indtrængen. I løber gennem korridorer, undgår sikkerhedssystemer.","[wave amp=25 freq=3][color=RED]Alarme schrillen[/color][/wave] während Wachen herbeieilen, um auf euren Einbruch zu reagieren. Ihr rast durch Korridore, weicht Sicherheitssystemen aus.","[wave amp=25 freq=3][color=RED]Las alarmas suenan[/color][/wave] mientras los guardias se apresuran a responder a vuestra intrusión. Corréis por los pasillos, esquivando sistemas de seguridad.","[wave amp=25 freq=3][color=RED]Hälytykset soivat[/color][/wave] kun vartijat ryntäävät vastaamaan tunkeutumiiseenne. Juoksette käytäviä pitkin, väistellen turvajärjestelmiä.","[wave amp=25 freq=3][color=RED]Les alarmes retentissent[/color][/wave] tandis que les gardes se précipitent pour répondre à votre intrusion. Vous courez à travers les couloirs, évitant les systèmes de sécurité.","[wave amp=25 freq=3][color=RED]Riasztók szólnak[/color][/wave], miközben az őrök sietnek reagálni a behatolásotokra. Folyosókon rohantok keresztül, kikerülve a biztonsági rendszereket.","[wave amp=25 freq=3][color=RED]Alarm berbunyi[/color][/wave] saat penjaga bergegas merespons intrusi kalian. Kalian berlari melalui koridor, menghindari sistem keamanan.","[wave amp=25 freq=3][color=RED]Gli allarmi suonano[/color][/wave] mentre le guardie si affrettano a rispondere alla vostra intrusione. Correte attraverso i corridoi, evitando i sistemi di sicurezza.","[wave amp=25 freq=3][color=RED]Alarmen loeien[/color][/wave] terwijl bewakers zich haasten om te reageren op jullie indringing. Jullie racen door gangen, ontwijken beveiligingssystemen.","[wave amp=25 freq=3][color=RED]Alarmer uler[/color][/wave] mens vakter haster for å svare på inntrengningen deres. Dere løper gjennom korridorer, unngår sikkerhetssystemer.","[wave amp=25 freq=3][color=RED]Alarmy wyją[/color][/wave] gdy strażnicy spieszą, by zareagować na waszą intruzję. Pędzicie przez korytarze, unikając systemów bezpieczeństwa.","[wave amp=25 freq=3][color=RED]Alarmes soam[/color][/wave] enquanto guardas se apressam para responder à sua intrusão. Vocês correm pelos corredores, desviando de sistemas de segurança.","[wave amp=25 freq=3][color=RED]Alarmele urlă[/color][/wave] în timp ce gărzile se grăbesc să răspundă la intruziunea voastră. Voi alergați prin coridoare, evitând sistemele de securitate.","[wave amp=25 freq=3][color=RED]Alarmy vyjú[/color][/wave] zatiaľ čo stráže sa ponáhľajú reagovať na váš prienik. Preháňate sa chodbami, vyhýbate sa bezpečnostným systémom.","[wave amp=25 freq=3][color=RED]Larm tjuter[/color][/wave] medan vakter skyndar för att svara på ert intrång. Ni rusar genom korridorer, undviker säkerhetssystem.","[wave amp=25 freq=3][color=RED]Alarmlar çalıyor[/color][/wave] muhafızlar sızmanıza tepki vermek için acele ederken. Koridorlardan koşuyor, güvenlik sistemlerinden kaçınıyorsunuz.","[wave amp=25 freq=3][color=RED]Còi báo động vang lên[/color][/wave] khi các lính gác vội vã phản ứng với sự xâm nhập của bạn. Bạn chạy qua các hành lang, tránh các hệ thống an ninh.","[wave amp=25 freq=3][color=RED]Alarms blare[/color][/wave] as guards scramble to respond to your intrusion. You race through corridors, dodging security systems.","[wave amp=25 freq=3][color=RED]Alarms blare[/color][/wave] as guards scramble to respond to your intrusion. You race through corridors, dodging security systems.","[wave amp=25 freq=3][color=RED]Alarms blare[/color][/wave] as guards scramble to respond to your intrusion. You race through corridors, dodging security systems.","[wave amp=25 freq=3][color=RED]Alarms blare[/color][/wave] as guards scramble to respond to your intrusion. You race through corridors, dodging security systems.","[wave amp=25 freq=3][color=RED]Alarms blare[/color][/wave] as guards scramble to respond to your intrusion. You race through corridors, dodging security systems.","[wave amp=25 freq=3][color=RED]Alarms blare[/color][/wave] as guards scramble to respond to your intrusion. You race through corridors, dodging security systems.","[wave amp=25 freq=3][color=RED]Alarms blare[/color][/wave] as guards scramble to respond to your intrusion. You race through corridors, dodging security systems.","[wave amp=25 freq=3][color=RED]Alarms blare[/color][/wave] as guards scramble to respond to your intrusion. You race through corridors, dodging security systems.","[wave amp=25 freq=3][color=RED]Alarms blare[/color][/wave] as guards scramble to respond to your intrusion. You race through corridors, dodging security systems.","[wave amp=25 freq=3][color=RED]Alarms blare[/color][/wave] as guards scramble to respond to your intrusion. You race through corridors, dodging security systems.","[wave amp=25 freq=3][color=RED]Alarms blare[/color][/wave] as guards scramble to respond to your intrusion. You race through corridors, dodging security systems.","[wave amp=25 freq=3][color=RED]Alarms blare[/color][/wave] as guards scramble to respond to your intrusion. You race through corridors, dodging security systems."
Text/1c/text,"A screen flickers on. ""Well well, the [color=CRIMSON]traitor[/color] returns with rebel scum.""","Obrazovka zabliká. ""No no, [color=CRIMSON]zrádce[/color] se vrací s rebelskou spodinou.""","En skærm flimrer. ""Nå nå, [color=CRIMSON]forræderen[/color] vender tilbage med rebellernes afskum.""","Ein Bildschirm flackert an. ""Nun, nun, der [color=CRIMSON]Verräter[/color] kehrt mit rebellischem Abschaum zurück.""","Una pantalla parpadea. ""Vaya, vaya, el [color=CRIMSON]traidor[/color] regresa con escoria rebelde.""","Näyttö välkkyy päälle. ""No niin, [color=CRIMSON]petturi[/color] palaa kapinallisroskan kanssa.""","Un écran s'allume. ""Eh bien, eh bien, le [color=CRIMSON]traître[/color] revient avec la vermine rebelle.""","Egy képernyő villan fel. ""Nos, nos, a [color=CRIMSON]áruló[/color] visszatér a lázadó söpredékkel.""","Sebuah layar berkedip. ""Wah wah, si [color=CRIMSON]pengkhianat[/color] kembali dengan sampah pemberontak.""","Uno schermo si accende. ""Bene bene, il [color=CRIMSON]traditore[/color] ritorna con la feccia ribelle.""","Een scherm flikkert aan. ""Wel, wel, de [color=CRIMSON]verrader[/color] keert terug met rebellentuig.""","En skjerm blinker på. ""Vel, vel, [color=CRIMSON]forræderen[/color] returnerer med rebellavskum.""","Ekran migocze. ""No, no, [color=CRIMSON]zdrajca[/color] wraca z rebelianckimi szumowinami.""","Uma tela pisca. ""Bem, bem, o [color=CRIMSON]traidor[/color] retorna com a escória rebelde.""","Un ecran pâlpâie. ""Ei bine, [color=CRIMSON]trădătorul[/color] se întoarce cu scursurile rebele.""","Obrazovka zabliká. ""No, no, [color=CRIMSON]zradca[/color] sa vracia s rebelskou spodinou.""","En skärm flimrar till. ""Jaha, jaha, [color=CRIMSON]förrädaren[/color] återvänder med rebellavskum.""","Bir ekran titreşiyor. ""Pekala, [color=CRIMSON]hain[/color] asi çöplerle geri dönüyor.""","Một màn hình nhấp nháy. ""Ồ, ồ, [color=CRIMSON]kẻ phản bội[/color] trở lại với lũ nổi loạn cặn bã.""","A screen flickers on. ""Well well, the [color=CRIMSON]traitor[/color] returns with rebel scum.""","A screen flickers on. ""Well well, the [color=CRIMSON]traitor[/color] returns with rebel scum.""","A screen flickers on. ""Well well, the [color=CRIMSON]traitor[/color] returns with rebel scum.""","A screen flickers on. ""Well well, the [color=CRIMSON]traitor[/color] returns with rebel scum.""","A screen flickers on. ""Well well, the [color=CRIMSON]traitor[/color] returns with rebel scum.""","A screen flickers on. ""Well well, the [color=CRIMSON]traitor[/color] returns with rebel scum.""","A screen flickers on. ""Well well, the [color=CRIMSON]traitor[/color] returns with rebel scum.""","A screen flickers on. ""Well well, the [color=CRIMSON]traitor[/color] returns with rebel scum.""","A screen flickers on. ""Well well, the [color=CRIMSON]traitor[/color] returns with rebel scum.""","A screen flickers on. ""Well well, the [color=CRIMSON]traitor[/color] returns with rebel scum.""","A screen flickers on. ""Well well, the [color=CRIMSON]traitor[/color] returns with rebel scum.""","A screen flickers on. ""Well well, the [color=CRIMSON]traitor[/color] returns with rebel scum."""
Text/1d/text,Did you think you could stop the progress of Spud? [color=DARK_VIOLET]Root Reserve[/color] is the lifeblood of this nation.,"Myslel sis, že můžeš zastavit pokrok Spudu? [color=DARK_VIOLET]Kořenová Rezerva[/color] je životní silou tohoto národa.","Troede du, at du kunne stoppe Spuds fremskridt? [color=DARK_VIOLET]Rod Reservatet[/color] er denne nations livsblod.","Dachtest du, du könntest den Fortschritt von Spud aufhalten? Die [color=DARK_VIOLET]Wurzelreserve[/color] ist das Lebenselixier dieser Nation.",¿Pensaste que podrías detener el progreso de Spud? La [color=DARK_VIOLET]Reserva Raíz[/color] es la fuerza vital de esta nación.,Luulitko voivasi pysäyttää Spudin edistyksen? [color=DARK_VIOLET]Juurivarasto[/color] on tämän kansakunnan elinvoima.,Pensais-tu pouvoir arrêter le progrès de Spud ? La [color=DARK_VIOLET]Réserve Racine[/color] est le sang vital de cette nation.,"Azt hitted, megállíthatod Spud fejlődését? A [color=DARK_VIOLET]Gyökértartalék[/color] e nemzet életere.",Apakah kamu pikir kamu bisa menghentikan kemajuan Spud? [color=DARK_VIOLET]Cadangan Akar[/color] adalah urat nadi bangsa ini.,Pensavi di poter fermare il progresso di Spud? La [color=DARK_VIOLET]Riserva Radice[/color] è la linfa vitale di questa nazione.,Dacht je dat je de vooruitgang van Spud kon stoppen? De [color=DARK_VIOLET]Wortelreserve[/color] is de levensader van deze natie.,Trodde du at du kunne stoppe Spuds fremgang? [color=DARK_VIOLET]Rotreserven[/color] er denne nasjonens livsblod.,"Myślałeś, że możesz zatrzymać postęp Spud? [color=DARK_VIOLET]Korzeniowa Rezerwa[/color] jest życiodajną siłą tego narodu.",Você achou que poderia deter o progresso de Spud? A [color=DARK_VIOLET]Reserva Raiz[/color] é a força vital desta nação.,Ai crezut că poți opri progresul Spud? [color=DARK_VIOLET]Rezerva Rădăcină[/color] este forța vitală a acestei națiuni.,"Myslel si, že môžeš zastaviť pokrok Spudu? [color=DARK_VIOLET]Koreňová Rezerva[/color] je životnou silou tohto národa.",Trodde du att du kunde stoppa Spuds framsteg? [color=DARK_VIOLET]Rotreservatet[/color] är denna nations livsblod.,Spud'un ilerleyişini durdurabileceğini mi sandın? [color=DARK_VIOLET]Kök Rezervi[/color] bu ulusun can damarıdır.,Ngươi nghĩ ngươi có thể ngăn cản sự tiến bộ của Spud sao? [color=DARK_VIOLET]Kho Dự Trữ Rễ[/color] là mạch máu của quốc gia này.,Did you think you could stop the progress of Spud? [color=DARK_VIOLET]Root Reserve[/color] is the lifeblood of this nation.,Did you think you could stop the progress of Spud? [color=DARK_VIOLET]Root Reserve[/color] is the lifeblood of this nation.,Did you think you could stop the progress of Spud? [color=DARK_VIOLET]Root Reserve[/color] is the lifeblood of this nation.,Did you think you could stop the progress of Spud? [color=DARK_VIOLET]Root Reserve[/color] is the lifeblood of this nation.,Did you think you could stop the progress of Spud? [color=DARK_VIOLET]Root Reserve[/color] is the lifeblood of this nation.,Did you think you could stop the progress of Spud? [color=DARK_VIOLET]Root Reserve[/color] is the lifeblood of this nation.,Did you think you could stop the progress of Spud? [color=DARK_VIOLET]Root Reserve[/color] is the lifeblood of this nation.,Did you think you could stop the progress of Spud? [color=DARK_VIOLET]Root Reserve[/color] is the lifeblood of this nation.,Did you think you could stop the progress of Spud? [color=DARK_VIOLET]Root Reserve[/color] is the lifeblood of this nation.,Did you think you could stop the progress of Spud? [color=DARK_VIOLET]Root Reserve[/color] is the lifeblood of this nation.,Did you think you could stop the progress of Spud? [color=DARK_VIOLET]Root Reserve[/color] is the lifeblood of this nation.,Did you think you could stop the progress of Spud? [color=DARK_VIOLET]Root Reserve[/color] is the lifeblood of this nation.
