Text/22/text,"After a harrowing escape through maintenance tunnels, you finally reach the secure elevator to Idaho's private bunker.",Po strastiplném úniku údržbářskými tunely konečně dosáhnete bezpečnostního výtahu do Idahova soukromého bunkru.,Efter en hårrejsende flugt gennem vedligeholdelsestunneler når I endelig den sikre elevator til Idahos private bunker.,Nach einer haarsträubenden Flucht durch Wartungstunnel erreicht ihr endlich den sicheren Aufzug zu Idahos privatem Bunker.,"Después de una angustiosa huida a través de túneles de mantenimiento, finalmente alcanzáis el ascensor seguro al búnker privado de Idaho.",Hirvittävän paon jälkeen huoltotunneleiden läpi saavutatte viimein turvallisen hissin Idahon yksityiseen bunkkeriin.,"Après une évasion effroyable à travers les tunnels de maintenance, vous atteignez enfin l'ascenseur sécurisé vers le bunker privé d'Idaho.",Egy hajmeresztő szökés után a karbantartó alagutakon keresztül végre eléritek a biztonságos liftet Idaho privát bunkeréhez.,"Setelah pelarian yang mencekam melalui terowongan pemeliharaan, akhirnya kalian mencapai lift aman ke bunker pribadi Idaho.","Dopo una fuga terrificante attraverso i tunnel di manutenzione, raggiungete finalmente l'ascensore sicuro per il bunker privato di Idaho.",Na een huiveringwekkende ontsnapping door onderhoudstunnels bereiken jullie eindelijk de beveiligde lift naar Idaho's privébunker.,Etter en hårreisende flukt gjennom vedlikeholdstunneler når dere endelig den sikre heisen til Idahos private bunker.,"Po przerażającej ucieczce przez tunele konserwacyjne, w końcu docieracie do zabezpieczonej windy do prywatnego bunkra Idaho.","Após uma fuga aterrorizante pelos túneis de manutenção, vocês finalmente alcançam o elevador seguro para o bunker privado de Idaho.","După o evadare înfricoșătoare prin tunelurile de întreținere, ajungeți în sfârșit la ascensorul securizat către buncărul privat al lui Idaho.",Po strastiplnom úniku cez údržbárske tunely konečne dosiahnete zabezpečený výťah do Idahovho súkromného bunkra.,Efter en hårresande flykt genom underhållstunnlar når ni äntligen den säkra hissen till Idahos privata bunker.,"Bakım tünellerinden korkunç bir kaçıştan sonra, nihayet Idaho'nun özel sığınağına giden güvenli asansöre ulaşıyorsunuz.","Sau cuộc trốn thoát kinh hoàng qua các đường hầm bảo trì, cuối cùng bạn cũng đến được thang máy an toàn dẫn tới boongke riêng của Idaho.","After a harrowing escape through maintenance tunnels, you finally reach the secure elevator to Idaho's private bunker.","After a harrowing escape through maintenance tunnels, you finally reach the secure elevator to Idaho's private bunker.","After a harrowing escape through maintenance tunnels, you finally reach the secure elevator to Idaho's private bunker.","After a harrowing escape through maintenance tunnels, you finally reach the secure elevator to Idaho's private bunker.","After a harrowing escape through maintenance tunnels, you finally reach the secure elevator to Idaho's private bunker.","After a harrowing escape through maintenance tunnels, you finally reach the secure elevator to Idaho's private bunker.","After a harrowing escape through maintenance tunnels, you finally reach the secure elevator to Idaho's private bunker.","After a harrowing escape through maintenance tunnels, you finally reach the secure elevator to Idaho's private bunker.","After a harrowing escape through maintenance tunnels, you finally reach the secure elevator to Idaho's private bunker.","After a harrowing escape through maintenance tunnels, you finally reach the secure elevator to Idaho's private bunker.","After a harrowing escape through maintenance tunnels, you finally reach the secure elevator to Idaho's private bunker.","After a harrowing escape through maintenance tunnels, you finally reach the secure elevator to Idaho's private bunker."
Text/23/text,"With Sasha and your allies at your side, you confront Idaho at last.",Se Sašou a svými spojenci po boku konečně konfrontuješ Idaha.,"Med Sasha og dine allierede ved din side, konfronterer du endelig Idaho.",Mit Sasha und deinen Verbündeten an deiner Seite konfrontierst du Idaho endlich.,"Con Sasha y tus aliados a tu lado, finalmente confrontas a Idaho.",Sashan ja liittolaistesi rinnalla kohtaat viimein Idahon.,"Avec Sasha et tes alliés à tes côtés, tu confrontes enfin Idaho.",Sashával és szövetségeseiddel az oldaladon végre szembesíted Idahót.,"Dengan Sasha dan sekutumu di sisimu, akhirnya kamu menghadapi Idaho.","Con Sasha e i tuoi alleati al tuo fianco, affronti finalmente Idaho.",Met Sasha en je bondgenoten aan je zijde confronteer je Idaho eindelijk.,"Med Sasha og dine allierte ved din side, konfronterer du endelig Idaho.","Z Saszą i twoimi sojusznikami u boku, w końcu konfrontujesz się z Idaho.","Com Sasha e seus aliados ao seu lado, você finalmente confronta Idaho.","Cu Sasha și aliații tăi alături, îl confrunți în sfârșit pe Idaho.",So Sašou a spojencami po boku nakoniec konfrontuješ Idaha.,Med Sasha och dina allierade vid din sida konfronterar du äntligen Idaho.,"Sasha ve müttefiklerinle yanında, sonunda Idaho ile yüzleşiyorsun.","Với Sasha và các đồng minh ở bên cạnh, cuối cùng bạn đối đầu với Idaho.","With Sasha and your allies at your side, you confront Idaho at last.","With Sasha and your allies at your side, you confront Idaho at last.","With Sasha and your allies at your side, you confront Idaho at last.","With Sasha and your allies at your side, you confront Idaho at last.","With Sasha and your allies at your side, you confront Idaho at last.","With Sasha and your allies at your side, you confront Idaho at last.","With Sasha and your allies at your side, you confront Idaho at last.","With Sasha and your allies at your side, you confront Idaho at last.","With Sasha and your allies at your side, you confront Idaho at last.","With Sasha and your allies at your side, you confront Idaho at last.","With Sasha and your allies at your side, you confront Idaho at last.","With Sasha and your allies at your side, you confront Idaho at last."
Text/24/text,"It's over, Idaho. Your secrets are exposed. How this ends... [pulse freq=2]that's up to you.[/pulse]","Je konec, Idaho. Tvá tajemství jsou odhalena. Jak to skončí... [pulse freq=2]to záleží na tobě.[/pulse]","Det er forbi, Idaho. Dine hemmeligheder er afsløret. Hvordan dette ender... [pulse freq=2]det er op til dig.[/pulse]","Es ist vorbei, Idaho. Deine Geheimnisse sind aufgedeckt. Wie das endet... [pulse freq=2]das liegt bei dir.[/pulse]","Se acabó, Idaho. Tus secretos están expuestos. Cómo termina esto... [pulse freq=2]eso depende de ti.[/pulse]","Se on ohi, Idaho. Salaisuutesi on paljastettu. Miten tämä päättyy... [pulse freq=2]se riippuu sinusta.[/pulse]","C'est fini, Idaho. Tes secrets sont exposés. Comment cela se termine... [pulse freq=2]c'est à toi de décider.[/pulse]","Vége van, Idaho. A titkaid lelepleződtek. Hogy ez hogyan végződik... [pulse freq=2]az rajtad múlik.[/pulse]","Sudah berakhir, Idaho. Rahasiamu terungkap. Bagaimana ini berakhir... [pulse freq=2]itu tergantung padamu.[/pulse]","È finita, Idaho. I tuoi segreti sono esposti. Come finirà... [pulse freq=2]dipende da te.[/pulse]","Het is voorbij, Idaho. Je geheimen zijn onthuld. Hoe dit eindigt... [pulse freq=2]dat hangt van jou af.[/pulse]","Det er over, Idaho. Hemmelighetene dine er avslørt. Hvordan dette ender... [pulse freq=2]det er opp til deg.[/pulse]","To koniec, Idaho. Twoje sekrety zostały ujawnione. Jak to się skończy... [pulse freq=2]to zależy od ciebie.[/pulse]","Acabou, Idaho. Seus segredos estão expostos. Como isso termina... [pulse freq=2]isso depende de você.[/pulse]","S-a terminat, Idaho. Secretele tale sunt expuse. Cum se termină asta... [pulse freq=2]depinde de tine.[/pulse]","Je koniec, Idaho. Tvoje tajomstvá sú odhalené. Ako to skončí... [pulse freq=2]to záleží na tebe.[/pulse]","Det är över, Idaho. Dina hemligheter är avslöjade. Hur detta slutar... [pulse freq=2]det är upp till dig.[/pulse]","Bitti, Idaho. Sırların açığa çıktı. Bunun nasıl biteceği... [pulse freq=2]bu sana bağlı.[/pulse]","Hết rồi, Idaho. Bí mật của ngươi đã bị phơi bày. Kết thúc này ra sao... [pulse freq=2]điều đó tùy thuộc vào ngươi.[/pulse]","It's over, Idaho. Your secrets are exposed. How this ends... [pulse freq=2]that's up to you.[/pulse]","It's over, Idaho. Your secrets are exposed. How this ends... [pulse freq=2]that's up to you.[/pulse]","It's over, Idaho. Your secrets are exposed. How this ends... [pulse freq=2]that's up to you.[/pulse]","It's over, Idaho. Your secrets are exposed. How this ends... [pulse freq=2]that's up to you.[/pulse]","It's over, Idaho. Your secrets are exposed. How this ends... [pulse freq=2]that's up to you.[/pulse]","It's over, Idaho. Your secrets are exposed. How this ends... [pulse freq=2]that's up to you.[/pulse]","It's over, Idaho. Your secrets are exposed. How this ends... [pulse freq=2]that's up to you.[/pulse]","It's over, Idaho. Your secrets are exposed. How this ends... [pulse freq=2]that's up to you.[/pulse]","It's over, Idaho. Your secrets are exposed. How this ends... [pulse freq=2]that's up to you.[/pulse]","It's over, Idaho. Your secrets are exposed. How this ends... [pulse freq=2]that's up to you.[/pulse]","It's over, Idaho. Your secrets are exposed. How this ends... [pulse freq=2]that's up to you.[/pulse]","It's over, Idaho. Your secrets are exposed. How this ends... [pulse freq=2]that's up to you.[/pulse]"
Choice/25/text,Negotiate a peaceful transition of power (Diplomatic),Vyjednat mírový přechod moci (Diplomatický),Forhandl en fredelig magtoverdragelse (Diplomatisk),Einen friedlichen Machtwechsel aushandeln (Diplomatisch),Negocia una transición pacífica del poder (Diplomático),Neuvottele rauhanomainen vallan siirto (Diplomaattinen),Négocier une transition pacifique du pouvoir (Diplomatique),Tárgyalj a hatalom békés átadásáról (Diplomáciai),Negosiasikan transisi kekuasaan yang damai (Diplomatik),Negozia una transizione pacifica del potere (Diplomatico),Onderhandel over een vreedzame machtsoverdracht (Diplomatiek),Forhandle en fredelig maktoverføring (Diplomatisk),Negocjuj pokojowe przekazanie władzy (Dyplomatyczne),Negociar uma transição pacífica de poder (Diplomático),Negociază o tranziție pașnică a puterii (Diplomatic),Vyjednaj pokojný prechod moci (Diplomatický),Förhandla om en fredlig maktövergång (Diplomatisk),Barışçıl bir güç geçişi müzakere et (Diplomatik),Đàm phán chuyển giao quyền lực hòa bình (Ngoại giao),Negotiate a peaceful transition of power (Diplomatic),Negotiate a peaceful transition of power (Diplomatic),Negotiate a peaceful transition of power (Diplomatic),Negotiate a peaceful transition of power (Diplomatic),Negotiate a peaceful transition of power (Diplomatic),Negotiate a peaceful transition of power (Diplomatic),Negotiate a peaceful transition of power (Diplomatic),Negotiate a peaceful transition of power (Diplomatic),Negotiate a peaceful transition of power (Diplomatic),Negotiate a peaceful transition of power (Diplomatic),Negotiate a peaceful transition of power (Diplomatic),Negotiate a peaceful transition of power (Diplomatic)
Choice/26/text,Demand Idaho's immediate arrest (Justice),Požadovat okamžité Idahovo zatčení (Spravedlnost),Kræv Idahos øjeblikkelige anholdelse (Retfærdighed),Idahos sofortige Verhaftung fordern (Gerechtigkeit),Exige el arresto inmediato de Idaho (Justicia),Vaadi Idahon välitöntä pidätystä (Oikeus),Exiger l'arrestation immédiate d'Idaho (Justice),Követeld Idaho azonnali letartóztatását (Igazságszolgáltatás),Tuntut penangkapan Idaho segera (Keadilan),Esigi l'arresto immediato di Idaho (Giustizia),Eis Idaho's onmiddellijke arrestatie (Rechtvaardigheid),Krev Idahos umiddelbare arrest (Rettferdighet),Żądaj natychmiastowego aresztowania Idaho (Sprawiedliwość),Exigir a prisão imediata de Idaho (Justiça),Cere arestarea imediată a lui Idaho (Justiție),Požaduj okamžité zatknutie Idaha (Spravodlivosť),Kräv Idahos omedelbara arrestering (Rättvisa),Idaho'nun derhal tutuklanmasını talep et (Adalet),Yêu cầu bắt giữ Idaho ngay lập tức (Công lý),Demand Idaho's immediate arrest (Justice),Demand Idaho's immediate arrest (Justice),Demand Idaho's immediate arrest (Justice),Demand Idaho's immediate arrest (Justice),Demand Idaho's immediate arrest (Justice),Demand Idaho's immediate arrest (Justice),Demand Idaho's immediate arrest (Justice),Demand Idaho's immediate arrest (Justice),Demand Idaho's immediate arrest (Justice),Demand Idaho's immediate arrest (Justice),Demand Idaho's immediate arrest (Justice),Demand Idaho's immediate arrest (Justice)
Choice/27/text,Enact vigilante justice for Idaho's crimes (Vengeance),Vykonat vigilantskou spravedlnost za Idahovy zločiny (Pomsta),Gennemfør selvtægtsjustits for Idahos forbrydelser (Hævn),Selbstjustiz für Idahos Verbrechen ausüben (Rache),Ejecuta justicia vigilante por los crímenes de Idaho (Venganza),Toteuta omankädenoikeus Idahon rikoksista (Kosto),Exercer une justice expéditive pour les crimes d'Idaho (Vengeance),Gyakorolj önbíráskodást Idaho bűneiért (Bosszú),Lakukan keadilan main hakim sendiri atas kejahatan Idaho (Pembalasan),Attua una giustizia da vigilante per i crimini di Idaho (Vendetta),Oefen eigenrichting uit voor Idaho's misdaden (Wraak),Utøv selvtekt for Idahos forbrytelser (Hevn),Wymierz samozwańczą sprawiedliwość za zbrodnie Idaho (Zemsta),Executar justiça vigilante pelos crimes de Idaho (Vingança),Execută justiție vigilantă pentru crimele lui Idaho (Răzbunare),Vykonaj vigilantskú spravodlivosť za Idahove zločiny (Pomsta),Verkställ vigilanträttvisa för Idahos brott (Hämnd),Idaho'nun suçları için kendi adaletini uygula (İntikam),Thực thi công lý tư hình cho tội ác của Idaho (Báo thù),Enact vigilante justice for Idaho's crimes (Vengeance),Enact vigilante justice for Idaho's crimes (Vengeance),Enact vigilante justice for Idaho's crimes (Vengeance),Enact vigilante justice for Idaho's crimes (Vengeance),Enact vigilante justice for Idaho's crimes (Vengeance),Enact vigilante justice for Idaho's crimes (Vengeance),Enact vigilante justice for Idaho's crimes (Vengeance),Enact vigilante justice for Idaho's crimes (Vengeance),Enact vigilante justice for Idaho's crimes (Vengeance),Enact vigilante justice for Idaho's crimes (Vengeance),Enact vigilante justice for Idaho's crimes (Vengeance),Enact vigilante justice for Idaho's crimes (Vengeance)
Choice/28/text,Focus on dismantling Root Reserve infrastructure (Dismantle),Zaměřit se na rozebrání infrastruktury Kořenové Rezervy (Demontáž),Fokusér på at nedbryde Rod Reservatets infrastruktur (Afmontering),Sich auf den Abbau der Wurzelreserve-Infrastruktur konzentrieren (Demontage),Concéntrate en desmantelar la infraestructura de la Reserva Raíz (Desmantelamiento),Keskity purkamaan Juurivaraston infrastruktuuri (Purkaminen),Se concentrer sur le démantèlement de l'infrastructure de la Réserve Racine (Démantèlement),Összpontosíts a Gyökértartalék infrastruktúrájának lebontására (Lebontás),Fokus pada pembongkaran infrastruktur Cadangan Akar (Pembongkaran),Concentrati sullo smantellamento dell'infrastruttura della Riserva Radice (Smantellamento),Focus op het ontmantelen van de Wortelreserve-infrastructuur (Ontmantelen),Fokuser på å demontere Rotreserve-infrastrukturen (Demontering),Skup się na demontażu infrastruktury Korzeniowej Rezerwy (Demontaż),Focar em desmantelar a infraestrutura da Reserva Raiz (Desmantelar),Concentrează-te pe demontarea infrastructurii Rezervei Rădăcină (Demontare),Zameraj sa na demontáž infraštruktúry Koreňovej Rezervy (Demontáž),Fokusera på att montera ner Rotreservatets infrastruktur (Demontering),Kök Rezervi altyapısını sökmeye odaklan (Sökme),Tập trung vào việc tháo dỡ cơ sở hạ tầng Kho Dự Trữ Rễ (Tháo dỡ),Focus on dismantling Root Reserve infrastructure (Dismantle),Focus on dismantling Root Reserve infrastructure (Dismantle),Focus on dismantling Root Reserve infrastructure (Dismantle),Focus on dismantling Root Reserve infrastructure (Dismantle),Focus on dismantling Root Reserve infrastructure (Dismantle),Focus on dismantling Root Reserve infrastructure (Dismantle),Focus on dismantling Root Reserve infrastructure (Dismantle),Focus on dismantling Root Reserve infrastructure (Dismantle),Focus on dismantling Root Reserve infrastructure (Dismantle),Focus on dismantling Root Reserve infrastructure (Dismantle),Focus on dismantling Root Reserve infrastructure (Dismantle),Focus on dismantling Root Reserve infrastructure (Dismantle)
Text/29/text,"Idaho, it doesn't have to end in more bloodshed. If you cooperate...","Idaho, nemusí to skončit dalším krveprolitím. Pokud budeš spolupracovat...","Idaho, det behøver ikke ende med mere blodsudgydelse. Hvis du samarbejder...","Idaho, es muss nicht mit weiterem Blutvergießen enden. Wenn du kooperierst...","Idaho, no tiene por qué terminar con más derramamiento de sangre. Si cooperas...","Idaho, tämän ei tarvitse päättyä lisäverilöylyyn. Jos teet yhteistyötä...","Idaho, cela n'a pas besoin de se terminer par plus d'effusion de sang. Si tu coopères...","Idaho, ennek nem kell több vérontással végződnie. Ha együttműködsz...","Idaho, ini tidak harus berakhir dengan pertumpahan darah lebih banyak. Jika kamu bekerja sama...","Idaho, non deve finire con altro spargimento di sangue. Se collabori...","Idaho, het hoeft niet te eindigen met meer bloedvergieten. Als je meewerkt...","Idaho, det trenger ikke å ende med mer blodsutgytelse. Hvis du samarbeider...","Idaho, to nie musi kończyć się kolejnym rozlewem krwi. Jeśli będziesz współpracować...","Idaho, não precisa terminar com mais derramamento de sangue. Se você cooperar...","Idaho, nu trebuie să se termine cu mai multă vărsare de sânge. Dacă cooperezi...","Idaho, nemusí to skončiť ďalším krviprelievaním. Ak budeš spolupracovať...","Idaho, det behöver inte sluta med mer blodsutgjutelse. Om du samarbetar...","Idaho, daha fazla kan dökülmesiyle bitmek zorunda değil. Eğer işbirliği yaparsan...","Idaho, điều này không cần phải kết thúc bằng thêm đổ máu. Nếu ngươi hợp tác...","Idaho, it doesn't have to end in more bloodshed. If you cooperate...","Idaho, it doesn't have to end in more bloodshed. If you cooperate...","Idaho, it doesn't have to end in more bloodshed. If you cooperate...","Idaho, it doesn't have to end in more bloodshed. If you cooperate...","Idaho, it doesn't have to end in more bloodshed. If you cooperate...","Idaho, it doesn't have to end in more bloodshed. If you cooperate...","Idaho, it doesn't have to end in more bloodshed. If you cooperate...","Idaho, it doesn't have to end in more bloodshed. If you cooperate...","Idaho, it doesn't have to end in more bloodshed. If you cooperate...","Idaho, it doesn't have to end in more bloodshed. If you cooperate...","Idaho, it doesn't have to end in more bloodshed. If you cooperate...","Idaho, it doesn't have to end in more bloodshed. If you cooperate..."
Text/2a/text,"Oh, you [color=STEEL_BLUE]idealistic fool[/color]. You think this is a negotiation?","Ach, ty [color=STEEL_BLUE]idealistický blázne[/color]. Myslíš si, že je to vyjednávání?","Åh, din [color=STEEL_BLUE]idealistiske tåbe[/color]. Tror du dette er en forhandling?","Oh, du [color=STEEL_BLUE]idealistischer Narr[/color]. Du denkst, das ist eine Verhandlung?","Oh, tú [color=STEEL_BLUE]idealista ingenuo[/color]. ¿Crees que esto es una negociación?",Voi sinua [color=STEEL_BLUE]idealistista hölmöä[/color]. Luuletko tämän olevan neuvottelu?,"Oh, espèce d'[color=STEEL_BLUE]idéaliste naïf[/color]. Tu penses que c'est une négociation ?","Ó, te [color=STEEL_BLUE]idealista bolond[/color]. Azt hiszed, ez egy tárgyalás?","Oh, kau [color=STEEL_BLUE]orang idealis bodoh[/color]. Kau pikir ini negosiasi?","Oh, tu [color=STEEL_BLUE]idealista illuso[/color]. Pensi che questa sia una negoziazione?","Oh, jij [color=STEEL_BLUE]idealistische dwaas[/color]. Denk je dat dit een onderhandeling is?","Åh, din [color=STEEL_BLUE]idealistiske narr[/color]. Tror du dette er en forhandling?","Och, ty [color=STEEL_BLUE]idealistyczny głupcze[/color]. Myślisz, że to negocjacje?","Oh, seu [color=STEEL_BLUE]idealista tolo[/color]. Você acha que isso é uma negociação?","Oh, tu [color=STEEL_BLUE]idealist naiv[/color]. Crezi că asta e o negociere?","Ach, ty [color=STEEL_BLUE]idealistický blázon[/color]. Myslíš si, že toto je vyjednávanie?","Åh, din [color=STEEL_BLUE]idealistiska dåre[/color]. Tror du att detta är en förhandling?","Ah, seni [color=STEEL_BLUE]idealist aptal[/color]. Bunun bir müzakere olduğunu mu sanıyorsun?","Ôi, ngươi [color=STEEL_BLUE]kẻ lý tưởng ngây thơ[/color]. Ngươi nghĩ đây là một cuộc đàm phán sao?","Oh, you [color=STEEL_BLUE]idealistic fool[/color]. You think this is a negotiation?","Oh, you [color=STEEL_BLUE]idealistic fool[/color]. You think this is a negotiation?","Oh, you [color=STEEL_BLUE]idealistic fool[/color]. You think this is a negotiation?","Oh, you [color=STEEL_BLUE]idealistic fool[/color]. You think this is a negotiation?","Oh, you [color=STEEL_BLUE]idealistic fool[/color]. You think this is a negotiation?","Oh, you [color=STEEL_BLUE]idealistic fool[/color]. You think this is a negotiation?","Oh, you [color=STEEL_BLUE]idealistic fool[/color]. You think this is a negotiation?","Oh, you [color=STEEL_BLUE]idealistic fool[/color]. You think this is a negotiation?","Oh, you [color=STEEL_BLUE]idealistic fool[/color]. You think this is a negotiation?","Oh, you [color=STEEL_BLUE]idealistic fool[/color]. You think this is a negotiation?","Oh, you [color=STEEL_BLUE]idealistic fool[/color]. You think this is a negotiation?","Oh, you [color=STEEL_BLUE]idealistic fool[/color]. You think this is a negotiation?"
