keys,en,cs,da,de,es,fi,fr,hu,id,it,nl,no,pl,pt,ro,sk,sv,tr,vi,ar,bg,el,es-419,ja,ko,pt-BR,ru,th,uk,zh-CN,zh-TW
Text/11/text,"The Spud border is in [pulse freq=3][color=CRIMSON]chaos[/color][/pulse]. Panicked potatoes flood checkpoints, desperate to escape after the leaked documents.","Hranice Spudu je v [pulse freq=3][color=CRIMSON]chaosu[/color][/pulse]. Vyděšené brambory zaplavují kontrolní stanoviště, zoufale se snaží uniknout po úniku dokumentů.","Spud-grænsen er i [pulse freq=3][color=CRIMSON]kaos[/color][/pulse]. Paniske kartofler oversvømmer kontrolposter, desperate for at undslippe efter de lækkede dokumenter.","Die Spud-Grenze ist im [pulse freq=3][color=CRIMSON]Chaos[/color][/pulse]. Panische Kartoffeln überfluten die Kontrollpunkte, verzweifelt darauf aus, nach den durchgesickerten Dokumenten zu fliehen.","La frontera de Spud está en [pulse freq=3][color=CRIMSON]caos[/color][/pulse]. Patatas aterrorizadas inundan los puestos de control, desesperadas por escapar tras la filtración de documentos.","Spudin raja on [pulse freq=3][color=CRIMSON]kaaoksessa[/color][/pulse]. Panikoituneet perunat tulvivat tarkastuspisteille, epätoivoisina paetakseen vuodettujen asiakirjojen jälkeen.","La frontière de Spud est en [pulse freq=3][color=CRIMSON]chaos[/color][/pulse]. Des pommes de terre paniquées inondent les points de contrôle, désespérées de s'échapper après la fuite des documents.","A Spud határ [pulse freq=3][color=CRIMSON]káoszban[/color][/pulse] van. Pánikba esett krumplik özönlik el az ellenőrzőpontokat, kétségbeesetten menekülve a kiszivárgott dokumentumok után.","Perbatasan Spud dalam [pulse freq=3][color=CRIMSON]kekacauan[/color][/pulse]. Kentang-kentang panik membanjiri pos pemeriksaan, putus asa untuk melarikan diri setelah dokumen bocor.","Il confine di Spud è nel [pulse freq=3][color=CRIMSON]caos[/color][/pulse]. Patate in preda al panico inondano i posti di controllo, disperate di fuggire dopo i documenti trapelati.","De Spud-grens is in [pulse freq=3][color=CRIMSON]chaos[/color][/pulse]. Panische aardappelen overspoelen de controlepunten, wanhopig om te ontsnappen na de gelekte documenten.","Spud-grensen er i [pulse freq=3][color=CRIMSON]kaos[/color][/pulse]. Panikksslagne poteter oversvømmer kontrollpunktene, desperate etter å flykte etter de lekkede dokumentene.","Granica Spud jest w [pulse freq=3][color=CRIMSON]chaosie[/color][/pulse]. Spanikowane ziemniaki zalewają punkty kontrolne, zdesperowane, by uciec po wycieku dokumentów.","A fronteira de Spud está em [pulse freq=3][color=CRIMSON]caos[/color][/pulse]. Batatas em pânico inundam os postos de controle, desesperadas para escapar após os documentos vazados.","Granița Spud este în [pulse freq=3][color=CRIMSON]haos[/color][/pulse]. Cartofi panicați inundă punctele de control, disperați să scape după documentele scurse.","Hranica Spudu je v [pulse freq=3][color=CRIMSON]chaose[/color][/pulse]. Panikárske zemiaky zaplavujú kontrolné stanovištia, zúfalo sa snažia uniknúť po úniku dokumentov.","Spud-gränsen är i [pulse freq=3][color=CRIMSON]kaos[/color][/pulse]. Panikslagna potatisar översvämmar kontrollpunkterna, desperata att fly efter de läckta dokumenten.","Spud sınırı [pulse freq=3][color=CRIMSON]kaos[/color][/pulse] içinde. Panik içindeki patatesler, sızan belgelerden sonra kaçmak için kontrol noktalarını dolduruyor.","Biên giới Spud đang trong tình trạng [pulse freq=3][color=CRIMSON]hỗn loạn[/color][/pulse]. Những củ khoai tây hoảng loạn tràn ngập các trạm kiểm soát, tuyệt vọng trốn chạy sau khi các tài liệu bị rò rỉ.","The Spud border is in [pulse freq=3][color=CRIMSON]chaos[/color][/pulse]. Panicked potatoes flood checkpoints, desperate to escape after the leaked documents.","The Spud border is in [pulse freq=3][color=CRIMSON]chaos[/color][/pulse]. Panicked potatoes flood checkpoints, desperate to escape after the leaked documents.","The Spud border is in [pulse freq=3][color=CRIMSON]chaos[/color][/pulse]. Panicked potatoes flood checkpoints, desperate to escape after the leaked documents.","The Spud border is in [pulse freq=3][color=CRIMSON]chaos[/color][/pulse]. Panicked potatoes flood checkpoints, desperate to escape after the leaked documents.","The Spud border is in [pulse freq=3][color=CRIMSON]chaos[/color][/pulse]. Panicked potatoes flood checkpoints, desperate to escape after the leaked documents.","The Spud border is in [pulse freq=3][color=CRIMSON]chaos[/color][/pulse]. Panicked potatoes flood checkpoints, desperate to escape after the leaked documents.","The Spud border is in [pulse freq=3][color=CRIMSON]chaos[/color][/pulse]. Panicked potatoes flood checkpoints, desperate to escape after the leaked documents.","The Spud border is in [pulse freq=3][color=CRIMSON]chaos[/color][/pulse]. Panicked potatoes flood checkpoints, desperate to escape after the leaked documents.","The Spud border is in [pulse freq=3][color=CRIMSON]chaos[/color][/pulse]. Panicked potatoes flood checkpoints, desperate to escape after the leaked documents.","The Spud border is in [pulse freq=3][color=CRIMSON]chaos[/color][/pulse]. Panicked potatoes flood checkpoints, desperate to escape after the leaked documents.","The Spud border is in [pulse freq=3][color=CRIMSON]chaos[/color][/pulse]. Panicked potatoes flood checkpoints, desperate to escape after the leaked documents.","The Spud border is in [pulse freq=3][color=CRIMSON]chaos[/color][/pulse]. Panicked potatoes flood checkpoints, desperate to escape after the leaked documents."
Text/12/text,You slip through with Sasha. [wave amp=20 freq=3][color=CHARTREUSE]We have to keep pushing![/color][/wave] The people know the truth now.,Proklouzneš s Sašou. [wave amp=20 freq=3][color=CHARTREUSE]Musíme pokračovat dál![/color][/wave] Lidé teď znají pravdu.,Du glider igennem med Sasha. [wave amp=20 freq=3][color=CHARTREUSE]Vi skal fortsætte fremad![/color][/wave] Folket kender nu sandheden.,Du schlüpfst mit Sasha hindurch. [wave amp=20 freq=3][color=CHARTREUSE]Wir müssen weitermachen![/color][/wave] Die Menschen kennen jetzt die Wahrheit.,Te deslizas con Sasha. [wave amp=20 freq=3][color=CHARTREUSE]¡Tenemos que seguir adelante![/color][/wave] La gente ahora conoce la verdad.,Livahdatte läpi Sashan kanssa. [wave amp=20 freq=3][color=CHARTREUSE]Meidän on jatkettava eteenpäin![/color][/wave] Ihmiset tietävät nyt totuuden.,Tu te faufiles avec Sasha. [wave amp=20 freq=3][color=CHARTREUSE]Nous devons continuer à avancer ![/color][/wave] Le peuple connaît maintenant la vérité.,Átsurransz Sashával. [wave amp=20 freq=3][color=CHARTREUSE]Tovább kell haladnunk![/color][/wave] Az emberek most már ismerik az igazságot.,Kamu menyelinap bersama Sasha. [wave amp=20 freq=3][color=CHARTREUSE]Kita harus terus maju![/color][/wave] Orang-orang kini tahu kebenaran.,Ti intrufoli con Sasha. [wave amp=20 freq=3][color=CHARTREUSE]Dobbiamo continuare a spingere![/color][/wave] Le persone ora conoscono la verità.,Je glipt erdoor met Sasha. [wave amp=20 freq=3][color=CHARTREUSE]We moeten blijven doorgaan![/color][/wave] De mensen kennen nu de waarheid.,Du smetter igjennom med Sasha. [wave amp=20 freq=3][color=CHARTREUSE]Vi må fortsette å presse på![/color][/wave] Folket kjenner nå sannheten.,Prześlizgujesz się z Saszą. [wave amp=20 freq=3][color=CHARTREUSE]Musimy nadal naciskać![/color][/wave] Ludzie teraz znają prawdę.,Você se esgueira com Sasha. [wave amp=20 freq=3][color=CHARTREUSE]Temos que continuar avançando![/color][/wave] As pessoas agora conhecem a verdade.,Te strecori cu Sasha. [wave amp=20 freq=3][color=CHARTREUSE]Trebuie să continuăm să împingem![/color][/wave] Oamenii cunosc acum adevărul.,Prešmykneš sa s Sašou. [wave amp=20 freq=3][color=CHARTREUSE]Musíme pokračovať v tlaku![/color][/wave] Ľudia teraz poznajú pravdu.,Du slinker igenom med Sasha. [wave amp=20 freq=3][color=CHARTREUSE]Vi måste fortsätta pressa på![/color][/wave] Folket känner nu till sanningen.,Sasha ile içeri süzülüyorsun. [wave amp=20 freq=3][color=CHARTREUSE]İlerlemeye devam etmeliyiz![/color][/wave] İnsanlar artık gerçeği biliyor.,Bạn lẻn qua cùng Sasha. [wave amp=20 freq=3][color=CHARTREUSE]Chúng ta phải tiếp tục đẩy mạnh![/color][/wave] Người dân giờ đã biết sự thật.,You slip through with Sasha. [wave amp=20 freq=3][color=CHARTREUSE]We have to keep pushing![/color][/wave] The people know the truth now.,You slip through with Sasha. [wave amp=20 freq=3][color=CHARTREUSE]We have to keep pushing![/color][/wave] The people know the truth now.,You slip through with Sasha. [wave amp=20 freq=3][color=CHARTREUSE]We have to keep pushing![/color][/wave] The people know the truth now.,You slip through with Sasha. [wave amp=20 freq=3][color=CHARTREUSE]We have to keep pushing![/color][/wave] The people know the truth now.,You slip through with Sasha. [wave amp=20 freq=3][color=CHARTREUSE]We have to keep pushing![/color][/wave] The people know the truth now.,You slip through with Sasha. [wave amp=20 freq=3][color=CHARTREUSE]We have to keep pushing![/color][/wave] The people know the truth now.,You slip through with Sasha. [wave amp=20 freq=3][color=CHARTREUSE]We have to keep pushing![/color][/wave] The people know the truth now.,You slip through with Sasha. [wave amp=20 freq=3][color=CHARTREUSE]We have to keep pushing![/color][/wave] The people know the truth now.,You slip through with Sasha. [wave amp=20 freq=3][color=CHARTREUSE]We have to keep pushing![/color][/wave] The people know the truth now.,You slip through with Sasha. [wave amp=20 freq=3][color=CHARTREUSE]We have to keep pushing![/color][/wave] The people know the truth now.,You slip through with Sasha. [wave amp=20 freq=3][color=CHARTREUSE]We have to keep pushing![/color][/wave] The people know the truth now.,You slip through with Sasha. [wave amp=20 freq=3][color=CHARTREUSE]We have to keep pushing![/color][/wave] The people know the truth now.
Text/13/text,"They can't silence the truth any longer. If we can infiltrate the [color=DARK_VIOLET]Root Reserve[/color] facility and broadcast evidence, it'll [tornado radius=3 freq=2][color=CHARTREUSE]ignite the revolution[/color][/tornado].","Už nemohou pravdu umlčet. Pokud se nám podaří infiltrovat zařízení [color=DARK_VIOLET]Kořenové Rezervy[/color] a vysílat důkazy, [tornado radius=3 freq=2][color=CHARTREUSE]zažehne to revoluci[/color][/tornado].","De kan ikke længere undertrykke sandheden. Hvis vi kan infiltrere [color=DARK_VIOLET]Rod Reservatet[/color] og udsende beviser, vil det [tornado radius=3 freq=2][color=CHARTREUSE]tænde revolutionen[/color][/tornado].","Sie können die Wahrheit nicht länger zum Schweigen bringen. Wenn wir in die [color=DARK_VIOLET]Wurzelreserve[/color]-Anlage eindringen und Beweise übertragen können, wird es [tornado radius=3 freq=2][color=CHARTREUSE]die Revolution entfachen[/color][/tornado].","Ya no pueden silenciar la verdad. Si podemos infiltrarnos en la instalación de la [color=DARK_VIOLET]Reserva Raíz[/color] y transmitir pruebas, [tornado radius=3 freq=2][color=CHARTREUSE]encenderá la revolución[/color][/tornado].","He eivät voi enää vaientaa totuutta. Jos voimme soluttautua [color=DARK_VIOLET]Juurivarasto[/color]-laitokseen ja lähettää todisteita, se [tornado radius=3 freq=2][color=CHARTREUSE]sytyttää vallankumouksen[/color][/tornado].","Ils ne peuvent plus faire taire la vérité. Si nous pouvons infiltrer l'installation de la [color=DARK_VIOLET]Réserve Racine[/color] et diffuser des preuves, cela [tornado radius=3 freq=2][color=CHARTREUSE]déclenchera la révolution[/color][/tornado].","Többé nem hallgattathatják el az igazságot. Ha be tudunk szivárogni a [color=DARK_VIOLET]Gyökértartalék[/color] létesítménybe és bizonyítékokat sugározhatunk, az [tornado radius=3 freq=2][color=CHARTREUSE]lángra lobbantja a forradalmat[/color][/tornado].","Mereka tidak bisa lagi membungkam kebenaran. Jika kita bisa menyusup ke fasilitas [color=DARK_VIOLET]Cadangan Akar[/color] dan menyiarkan bukti, itu akan [tornado radius=3 freq=2][color=CHARTREUSE]memicu revolusi[/color][/tornado].","Non possono più mettere a tacere la verità. Se riusciamo a infiltrarci nella struttura della [color=DARK_VIOLET]Riserva Radice[/color] e trasmettere le prove, [tornado radius=3 freq=2][color=CHARTREUSE]scatenerà la rivoluzione[/color][/tornado].","Ze kunnen de waarheid niet langer het zwijgen opleggen. Als we kunnen infiltreren in de [color=DARK_VIOLET]Wortelreserve[/color] faciliteit en bewijsmateriaal uitzenden, zal het [tornado radius=3 freq=2][color=CHARTREUSE]de revolutie ontketenen[/color][/tornado].","De kan ikke lenger tie sannheten. Hvis vi kan infiltrere [color=DARK_VIOLET]Rotreserven[/color]-anlegget og kringkaste bevis, vil det [tornado radius=3 freq=2][color=CHARTREUSE]tenne revolusjonen[/color][/tornado].","Nie mogą już dłużej uciszać prawdy. Jeśli uda nam się infiltrować obiekt [color=DARK_VIOLET]Korzeniowej Rezerwy[/color] i nadać dowody, [tornado radius=3 freq=2][color=CHARTREUSE]rozpali to rewolucję[/color][/tornado].","Eles não podem mais silenciar a verdade. Se conseguirmos infiltrar na instalação da [color=DARK_VIOLET]Reserva Raiz[/color] e transmitir evidências, isso [tornado radius=3 freq=2][color=CHARTREUSE]acenderá a revolução[/color][/tornado].","Nu mai pot reduce adevărul la tăcere. Dacă putem infiltra facilitatea [color=DARK_VIOLET]Rezerva Rădăcină[/color] și transmite dovezi, va [tornado radius=3 freq=2][color=CHARTREUSE]aprinde revoluția[/color][/tornado].","Už nemôžu umlčať pravdu. Ak sa nám podarí infiltrovať zariadenie [color=DARK_VIOLET]Koreňová Rezerva[/color] a vysielať dôkazy, [tornado radius=3 freq=2][color=CHARTREUSE]zažne to revolúciu[/color][/tornado].","De kan inte längre tysta ned sanningen. Om vi kan infiltrera [color=DARK_VIOLET]Rotreservatets[/color] anläggning och sända bevis, kommer det att [tornado radius=3 freq=2][color=CHARTREUSE]tända revolutionen[/color][/tornado].","Artık gerçeği susturamıyorlar. Eğer [color=DARK_VIOLET]Kök Rezervi[/color] tesisine sızıp kanıtları yayınlayabilirsek, bu [tornado radius=3 freq=2][color=CHARTREUSE]devrimi ateşleyecek[/color][/tornado].","Họ không thể bịt miệng sự thật nữa. Nếu chúng ta có thể xâm nhập vào cơ sở [color=DARK_VIOLET]Kho Dự Trữ Rễ[/color] và phát tán bằng chứng, nó sẽ [tornado radius=3 freq=2][color=CHARTREUSE]châm ngòi cho cuộc cách mạng[/color][/tornado].","They can't silence the truth any longer. If we can infiltrate the [color=DARK_VIOLET]Root Reserve[/color] facility and broadcast evidence, it'll [tornado radius=3 freq=2][color=CHARTREUSE]ignite the revolution[/color][/tornado].","They can't silence the truth any longer. If we can infiltrate the [color=DARK_VIOLET]Root Reserve[/color] facility and broadcast evidence, it'll [tornado radius=3 freq=2][color=CHARTREUSE]ignite the revolution[/color][/tornado].","They can't silence the truth any longer. If we can infiltrate the [color=DARK_VIOLET]Root Reserve[/color] facility and broadcast evidence, it'll [tornado radius=3 freq=2][color=CHARTREUSE]ignite the revolution[/color][/tornado].","They can't silence the truth any longer. If we can infiltrate the [color=DARK_VIOLET]Root Reserve[/color] facility and broadcast evidence, it'll [tornado radius=3 freq=2][color=CHARTREUSE]ignite the revolution[/color][/tornado].","They can't silence the truth any longer. If we can infiltrate the [color=DARK_VIOLET]Root Reserve[/color] facility and broadcast evidence, it'll [tornado radius=3 freq=2][color=CHARTREUSE]ignite the revolution[/color][/tornado].","They can't silence the truth any longer. If we can infiltrate the [color=DARK_VIOLET]Root Reserve[/color] facility and broadcast evidence, it'll [tornado radius=3 freq=2][color=CHARTREUSE]ignite the revolution[/color][/tornado].","They can't silence the truth any longer. If we can infiltrate the [color=DARK_VIOLET]Root Reserve[/color] facility and broadcast evidence, it'll [tornado radius=3 freq=2][color=CHARTREUSE]ignite the revolution[/color][/tornado].","They can't silence the truth any longer. If we can infiltrate the [color=DARK_VIOLET]Root Reserve[/color] facility and broadcast evidence, it'll [tornado radius=3 freq=2][color=CHARTREUSE]ignite the revolution[/color][/tornado].","They can't silence the truth any longer. If we can infiltrate the [color=DARK_VIOLET]Root Reserve[/color] facility and broadcast evidence, it'll [tornado radius=3 freq=2][color=CHARTREUSE]ignite the revolution[/color][/tornado].","They can't silence the truth any longer. If we can infiltrate the [color=DARK_VIOLET]Root Reserve[/color] facility and broadcast evidence, it'll [tornado radius=3 freq=2][color=CHARTREUSE]ignite the revolution[/color][/tornado].","They can't silence the truth any longer. If we can infiltrate the [color=DARK_VIOLET]Root Reserve[/color] facility and broadcast evidence, it'll [tornado radius=3 freq=2][color=CHARTREUSE]ignite the revolution[/color][/tornado].","They can't silence the truth any longer. If we can infiltrate the [color=DARK_VIOLET]Root Reserve[/color] facility and broadcast evidence, it'll [tornado radius=3 freq=2][color=CHARTREUSE]ignite the revolution[/color][/tornado]."
Text/14/text,That place is a fortress. And now we've got a [color=YELLOW]former customs agent[/color] in our midst. Their eyes narrow at you suspiciously.,To místo je pevnost. A teď máme mezi sebou [color=YELLOW]bývalého celního agenta[/color]. Jejich oči se na tebe podezřívavě zúží.,Det sted er en fæstning. Og nu har vi en [color=YELLOW]tidligere toldagent[/color] iblandt os. Deres øjne snævrer mistænksomt ind mod dig.,Dieser Ort ist eine Festung. Und jetzt haben wir einen [color=YELLOW]ehemaligen Zollbeamten[/color] in unserer Mitte. Ihre Augen verengen sich misstrauisch auf dich.,Ese lugar es una fortaleza. Y ahora tenemos a un [color=YELLOW]antiguo agente de aduanas[/color] entre nosotros. Sus ojos se entrecierran con sospecha hacia ti.,Se paikka on linnoitus. Ja nyt keskuudessamme on [color=YELLOW]entinen tullivirkailija[/color]. Heidän silmänsä kaventuvat epäillen sinua kohtaan.,Cet endroit est une forteresse. Et maintenant nous avons un [color=YELLOW]ancien agent des douanes[/color] parmi nous. Ses yeux se rétrécissent avec suspicion vers toi.,Az a hely egy erőd. És most van köztünk egy [color=YELLOW]korábbi vámtiszt[/color]. Szemük gyanakodva szűkül össze feléd.,Tempat itu adalah benteng. Dan sekarang kita punya [color=YELLOW]mantan petugas bea cukai[/color] di tengah-tengah kita. Mata mereka menyipit curiga kepadamu.,Quel posto è una fortezza. E ora abbiamo un [color=YELLOW]ex agente doganale[/color] tra noi. I suoi occhi si restringono sospettosi verso di te.,Die plek is een fort. En nu hebben we een [color=YELLOW]voormalige douanebeambte[/color] in ons midden. Hun ogen vernauwen zich achterdochtig naar jou.,Det stedet er en festning. Og nå har vi en [color=YELLOW]tidligere tollbetjent[/color] blant oss. Øynene deres smalner mistenksomt mot deg.,To miejsce to forteca. A teraz mamy wśród nas [color=YELLOW]byłego agenta celnego[/color]. Ich oczy zwężają się podejrzliwie na twój widok.,Aquele lugar é uma fortaleza. E agora temos um [color=YELLOW]ex-agente alfandegário[/color] entre nós. Seus olhos se estreitam com suspeita para você.,Acel loc este o fortăreață. Și acum avem un [color=YELLOW]fost agent vamal[/color] printre noi. Ochii lor se îngustează suspicioși spre tine.,To miesto je pevnosť. A teraz máme medzi sebou [color=YELLOW]bývalého colného agenta[/color]. Ich oči sa na teba podozrievavo zúžia.,Den platsen är en fästning. Och nu har vi en [color=YELLOW]före detta tulltjänsteman[/color] ibland oss. Deras ögon smalnar misstänksamt mot dig.,O yer bir kale. Ve şimdi aramızda bir [color=YELLOW]eski gümrük görevlisi[/color] var. Gözleri şüpheyle sana daralıyor.,Nơi đó là một pháo đài. Và giờ chúng ta có một [color=YELLOW]cựu nhân viên hải quan[/color] trong hàng ngũ. Mắt họ nheo lại nghi ngờ về phía bạn.,That place is a fortress. And now we've got a [color=YELLOW]former customs agent[/color] in our midst. Their eyes narrow at you suspiciously.,That place is a fortress. And now we've got a [color=YELLOW]former customs agent[/color] in our midst. Their eyes narrow at you suspiciously.,That place is a fortress. And now we've got a [color=YELLOW]former customs agent[/color] in our midst. Their eyes narrow at you suspiciously.,That place is a fortress. And now we've got a [color=YELLOW]former customs agent[/color] in our midst. Their eyes narrow at you suspiciously.,That place is a fortress. And now we've got a [color=YELLOW]former customs agent[/color] in our midst. Their eyes narrow at you suspiciously.,That place is a fortress. And now we've got a [color=YELLOW]former customs agent[/color] in our midst. Their eyes narrow at you suspiciously.,That place is a fortress. And now we've got a [color=YELLOW]former customs agent[/color] in our midst. Their eyes narrow at you suspiciously.,That place is a fortress. And now we've got a [color=YELLOW]former customs agent[/color] in our midst. Their eyes narrow at you suspiciously.,That place is a fortress. And now we've got a [color=YELLOW]former customs agent[/color] in our midst. Their eyes narrow at you suspiciously.,That place is a fortress. And now we've got a [color=YELLOW]former customs agent[/color] in our midst. Their eyes narrow at you suspiciously.,That place is a fortress. And now we've got a [color=YELLOW]former customs agent[/color] in our midst. Their eyes narrow at you suspiciously.,That place is a fortress. And now we've got a [color=YELLOW]former customs agent[/color] in our midst. Their eyes narrow at you suspiciously.
Choice/15/text,"I understand your doubt, but I'm committed to this cause.","Chápu vaše pochybnosti, ale jsem této věci oddaný.","Jeg forstår jeres tvivl, men jeg er dedikeret til denne sag.","Ich verstehe eure Zweifel, aber ich bin dieser Sache verpflichtet.","Entiendo vuestra duda, pero estoy comprometido con esta causa.","Ymmärrän epäilyksenne, mutta olen sitoutunut tähän asiaan.","Je comprends vos doutes, mais je suis dévoué à cette cause.","Értem a kételyeiteket, de elkötelezett vagyok az ügy iránt.","Aku mengerti keraguan kalian, tapi aku berkomitmen pada tujuan ini.","Capisco i vostri dubbi, ma sono impegnato in questa causa.","Ik begrijp jullie twijfel, maar ik ben toegewijd aan deze zaak.","Jeg forstår tvilen deres, men jeg er forpliktet til denne saken.","Rozumiem wasze wątpliwości, ale jestem oddany tej sprawie.","Entendo suas dúvidas, mas estou comprometido com esta causa.","Înțeleg îndoiala voastră, dar sunt dedicat acestei cauze.","Chápem vaše pochybnosti, ale som oddaný tejto veci.","Jag förstår er tvivel, men jag är hängiven denna sak.","Şüphenizi anlıyorum, ama bu davaya bağlıyım.","Tôi hiểu sự nghi ngờ của các bạn, nhưng tôi cam kết với sự nghiệp này.","I understand your doubt, but I'm committed to this cause.","I understand your doubt, but I'm committed to this cause.","I understand your doubt, but I'm committed to this cause.","I understand your doubt, but I'm committed to this cause.","I understand your doubt, but I'm committed to this cause.","I understand your doubt, but I'm committed to this cause.","I understand your doubt, but I'm committed to this cause.","I understand your doubt, but I'm committed to this cause.","I understand your doubt, but I'm committed to this cause.","I understand your doubt, but I'm committed to this cause.","I understand your doubt, but I'm committed to this cause.","I understand your doubt, but I'm committed to this cause."
Choice/16/text,I've already sacrificed everything. I won't back down now.,Už jsem obětoval všechno. Teď neustoupím.,Jeg har allerede ofret alt. Jeg vil ikke vige tilbage nu.,Ich habe bereits alles geopfert. Ich werde jetzt nicht zurückweichen.,Ya he sacrificado todo. No me echaré atrás ahora.,Olen jo uhrannut kaiken. En peräänny nyt.,J'ai déjà tout sacrifié. Je ne reculerai pas maintenant.,Már mindent feláldoztam. Most nem hátrálok meg.,Aku sudah mengorbankan segalanya. Aku tidak akan mundur sekarang.,Ho già sacrificato tutto. Non mi tirerò indietro ora.,Ik heb al alles opgeofferd. Ik zal nu niet terugdeinzen.,Jeg har allerede ofret alt. Jeg vil ikke trekke meg nå.,Poświęciłem już wszystko. Nie wycoram się teraz.,Já sacrifiquei tudo. Não vou recuar agora.,Am sacrificat deja totul. Nu voi da înapoi acum.,Už som obetoval všetko. Teraz neustúpim.,Jag har redan offrat allt. Jag kommer inte att backa nu.,Zaten her şeyi feda ettim. Şimdi geri adım atmayacağım.,Tôi đã hy sinh tất cả rồi. Tôi sẽ không lùi bước lúc này.,I've already sacrificed everything. I won't back down now.,I've already sacrificed everything. I won't back down now.,I've already sacrificed everything. I won't back down now.,I've already sacrificed everything. I won't back down now.,I've already sacrificed everything. I won't back down now.,I've already sacrificed everything. I won't back down now.,I've already sacrificed everything. I won't back down now.,I've already sacrificed everything. I won't back down now.,I've already sacrificed everything. I won't back down now.,I've already sacrificed everything. I won't back down now.,I've already sacrificed everything. I won't back down now.,I've already sacrificed everything. I won't back down now.
