keys,hu
Text/63/text,"Szia, Sasha vagyok. Üdvözöllek a csapatban!"
Text/64/text,"Sasha közelebb hajol, ""És tartsd nyitva a szemed. Nem minden az, aminek látszik Spudban."""
Text/65/text,A következő jelentkező vár. Ellenőrizd alaposan azokat a bélyegzőket! Minden gyanús viselkedést jelenteni kell.
Text/66/text,"Ne feledd, egy kötelességtudó tisztnek nincs mitől félnie. Aki elhagyja kötelességét, elhagyja gyökereit is."
Text/67/text,...a Gyökér Tartalék termelési számai NAGYON MAGASAK. A csodálatos étel továbbra is táplálja nemzetünket...
Text/68/text,"További hírekben, a hiányzó burgonyákról szóló jelentések folytatódnak..."
