Text/2b/text,"Idaho smashes a button, and [color=RED]alarms begin blaring[/color]. ""The only thing I'll be giving you is a [color=DARK_VIOLET]one-way trip to the fry vats![/color]""","Idaho rozbije tlačítko a [color=RED]alarmy začnou kvílet[/color]. ""Jediné, co vám dám, je [color=DARK_VIOLET]jednosměrná cesta do fritovacích kádí![/color]""","Idaho smadrer en knap, og [color=RED]alarmer begynder at hyle[/color]. ""Det eneste jeg vil give jer er en [color=DARK_VIOLET]envejsbillet til friturebadene![/color]""","Idaho zerschmettert einen Knopf, und [color=RED]Alarme beginnen zu schrillen[/color]. ""Das Einzige, was ich euch geben werde, ist ein [color=DARK_VIOLET]Einwegticket zu den Frittierungsbottichen![/color]""","Idaho aplasta un botón, y [color=RED]las alarmas comienzan a sonar[/color]. ""¡Lo único que os daré es un [color=DARK_VIOLET]viaje de ida a las cubas de fritura![/color]""","Idaho murskaa painikkeen, ja [color=RED]hälytykset alkavat soida[/color]. ""Ainoa asia, jonka annan teille, on [color=DARK_VIOLET]yhdensuuntainen matka paistosammioihin![/color]""","Idaho écrase un bouton, et [color=RED]les alarmes commencent à retentir[/color]. ""La seule chose que je vous donnerai est un [color=DARK_VIOLET]aller simple vers les cuves de friture ![/color]""","Idaho összetör egy gombot, és [color=RED]riasztók kezdenek szólni[/color]. ""Az egyetlen dolog, amit nektek adok, egy [color=DARK_VIOLET]egyirányú jegy a sütőkádakba![/color]""","Idaho menghancurkan sebuah tombol, dan [color=RED]alarm mulai berbunyi[/color]. ""Satu-satunya hal yang akan kuberikan padamu adalah [color=DARK_VIOLET]tiket sekali jalan ke tangki penggorengan![/color]""","Idaho distrugge un pulsante, e [color=RED]gli allarmi iniziano a suonare[/color]. ""L'unica cosa che vi darò è un [color=DARK_VIOLET]biglietto di sola andata per le vasche di frittura![/color]""","Idaho verplettert een knop, en [color=RED]alarmen beginnen te loeien[/color]. ""Het enige wat ik jullie zal geven is een [color=DARK_VIOLET]enkele reis naar de frituurvaten![/color]""","Idaho knuser en knapp, og [color=RED]alarmer begynner å ule[/color]. ""Det eneste jeg kommer til å gi dere er en [color=DARK_VIOLET]enveisbillett til stekekummene![/color]""","Idaho miażdży przycisk, i [color=RED]alarmy zaczynają wyć[/color]. ""Jedyne, co wam dam, to [color=DARK_VIOLET]bilet w jedną stronę do kadzi smażalniczych![/color]""","Idaho esmaga um botão, e [color=RED]alarmes começam a soar[/color]. ""A única coisa que vou dar a vocês é uma [color=DARK_VIOLET]passagem só de ida para os tanques de fritura![/color]""","Idaho zdrobește un buton, și [color=RED]alarmele încep să sune[/color]. ""Singurul lucru pe care vi-l voi da este un [color=DARK_VIOLET]bilet doar dus către cazanele de prăjit![/color]""","Idaho rozbije tlačidlo a [color=RED]alarmy začnú vyť[/color]. ""Jediné, čo vám dám, je [color=DARK_VIOLET]jednosmerný lístok do fritovacích kadí![/color]""","Idaho krossar en knapp, och [color=RED]larm börjar tjuta[/color]. ""Det enda jag kommer att ge er är en [color=DARK_VIOLET]enkelresa till friteringskarets![/color]""","Idaho bir düğmeyi parçalıyor ve [color=RED]alarmlar çalmaya başlıyor[/color]. ""Size vereceğim tek şey [color=DARK_VIOLET]kızartma tanklarına tek yönlü bir bilet olacak![/color]""","Idaho đập nát một nút bấm, và [color=RED]còi báo động bắt đầu vang lên[/color]. ""Điều duy nhất ta sẽ cho các ngươi là một [color=DARK_VIOLET]vé một chiều đến các bể chiên![/color]""","Idaho smashes a button, and [color=RED]alarms begin blaring[/color]. ""The only thing I'll be giving you is a [color=DARK_VIOLET]one-way trip to the fry vats![/color]""","Idaho smashes a button, and [color=RED]alarms begin blaring[/color]. ""The only thing I'll be giving you is a [color=DARK_VIOLET]one-way trip to the fry vats![/color]""","Idaho smashes a button, and [color=RED]alarms begin blaring[/color]. ""The only thing I'll be giving you is a [color=DARK_VIOLET]one-way trip to the fry vats![/color]""","Idaho smashes a button, and [color=RED]alarms begin blaring[/color]. ""The only thing I'll be giving you is a [color=DARK_VIOLET]one-way trip to the fry vats![/color]""","Idaho smashes a button, and [color=RED]alarms begin blaring[/color]. ""The only thing I'll be giving you is a [color=DARK_VIOLET]one-way trip to the fry vats![/color]""","Idaho smashes a button, and [color=RED]alarms begin blaring[/color]. ""The only thing I'll be giving you is a [color=DARK_VIOLET]one-way trip to the fry vats![/color]""","Idaho smashes a button, and [color=RED]alarms begin blaring[/color]. ""The only thing I'll be giving you is a [color=DARK_VIOLET]one-way trip to the fry vats![/color]""","Idaho smashes a button, and [color=RED]alarms begin blaring[/color]. ""The only thing I'll be giving you is a [color=DARK_VIOLET]one-way trip to the fry vats![/color]""","Idaho smashes a button, and [color=RED]alarms begin blaring[/color]. ""The only thing I'll be giving you is a [color=DARK_VIOLET]one-way trip to the fry vats![/color]""","Idaho smashes a button, and [color=RED]alarms begin blaring[/color]. ""The only thing I'll be giving you is a [color=DARK_VIOLET]one-way trip to the fry vats![/color]""","Idaho smashes a button, and [color=RED]alarms begin blaring[/color]. ""The only thing I'll be giving you is a [color=DARK_VIOLET]one-way trip to the fry vats![/color]""","Idaho smashes a button, and [color=RED]alarms begin blaring[/color]. ""The only thing I'll be giving you is a [color=DARK_VIOLET]one-way trip to the fry vats![/color]"""
Text/2c/text,"I don't think so, Idaho. Guards! You saw the dossier, [color=YELLOW]you know what he did to your families.[/color]","Nemyslím si to, Idaho. Stráže! Viděli jste spis, [color=YELLOW]víte, co udělal vašim rodinám.[/color]","Det tror jeg ikke, Idaho. Vagter! I så dossieret, [color=YELLOW]I ved, hvad han gjorde mod jeres familier.[/color]","Das glaube ich nicht, Idaho. Wachen! Ihr habt die Akte gesehen, [color=YELLOW]ihr wisst, was er euren Familien angetan hat.[/color]","No lo creo, Idaho. ¡Guardias! Visteis el expediente, [color=YELLOW]sabéis lo que les hizo a vuestras familias.[/color]","En usko niin, Idaho. Vartijat! Näitte kansion, [color=YELLOW]tiedätte, mitä hän teki perheillenne.[/color]","Je ne crois pas, Idaho. Gardes ! Vous avez vu le dossier, [color=YELLOW]vous savez ce qu'il a fait à vos familles.[/color]","Nem hiszem, Idaho. Őrök! Láttátok az aktát, [color=YELLOW]tudjátok, mit tett a családjaitokkal.[/color]","Kurasa tidak, Idaho. Penjaga! Kalian melihat berkasnya, [color=YELLOW]kalian tahu apa yang dia lakukan pada keluarga kalian.[/color]","Non credo proprio, Idaho. Guardie! Avete visto il dossier, [color=YELLOW]sapete cosa ha fatto alle vostre famiglie.[/color]","Ik denk het niet, Idaho. Bewakers! Jullie hebben het dossier gezien, [color=YELLOW]jullie weten wat hij met jullie families heeft gedaan.[/color]","Det tror jeg ikke, Idaho. Vakter! Dere så mappen, [color=YELLOW]dere vet hva han gjorde mot familiene deres.[/color]","Nie sądzę, Idaho. Strażnicy! Widzieliście akta, [color=YELLOW]wiecie, co zrobił waszym rodzinom.[/color]","Acho que não, Idaho. Guardas! Vocês viram o dossiê, [color=YELLOW]sabem o que ele fez com suas famílias.[/color]","Nu cred, Idaho. Gărzi! Ați văzut dosarul, [color=YELLOW]știți ce le-a făcut familiilor voastre.[/color]","Nemyslím si, Idaho. Stráže! Videli ste spis, [color=YELLOW]viete, čo urobil vašim rodinám.[/color]","Det tror jag inte, Idaho. Vakter! Ni såg dossiern, [color=YELLOW]ni vet vad han gjorde mot era familjer.[/color]","Sanmıyorum, Idaho. Muhafızlar! Dosyayı gördünüz, [color=YELLOW]ailelerinize ne yaptığını biliyorsunuz.[/color]","Tôi không nghĩ vậy, Idaho. Lính gác! Các người đã thấy hồ sơ, [color=YELLOW]các người biết hắn đã làm gì với gia đình các người.[/color]","I don't think so, Idaho. Guards! You saw the dossier, [color=YELLOW]you know what he did to your families.[/color]","I don't think so, Idaho. Guards! You saw the dossier, [color=YELLOW]you know what he did to your families.[/color]","I don't think so, Idaho. Guards! You saw the dossier, [color=YELLOW]you know what he did to your families.[/color]","I don't think so, Idaho. Guards! You saw the dossier, [color=YELLOW]you know what he did to your families.[/color]","I don't think so, Idaho. Guards! You saw the dossier, [color=YELLOW]you know what he did to your families.[/color]","I don't think so, Idaho. Guards! You saw the dossier, [color=YELLOW]you know what he did to your families.[/color]","I don't think so, Idaho. Guards! You saw the dossier, [color=YELLOW]you know what he did to your families.[/color]","I don't think so, Idaho. Guards! You saw the dossier, [color=YELLOW]you know what he did to your families.[/color]","I don't think so, Idaho. Guards! You saw the dossier, [color=YELLOW]you know what he did to your families.[/color]","I don't think so, Idaho. Guards! You saw the dossier, [color=YELLOW]you know what he did to your families.[/color]","I don't think so, Idaho. Guards! You saw the dossier, [color=YELLOW]you know what he did to your families.[/color]","I don't think so, Idaho. Guards! You saw the dossier, [color=YELLOW]you know what he did to your families.[/color]"
Text/2d/text,A hulking guard steps forward and kicks Idaho to the ground swiftly.,Obrovská stráž vystoupí vpřed a rychle srazí Idaha k zemi.,En kæmpestor vagt træder frem og sparker hurtigt Idaho til jorden.,Ein bulliger Wächter tritt vor und stößt Idaho rasch zu Boden.,Un guardia corpulento da un paso adelante y derriba rápidamente a Idaho al suelo.,Valtava vartija astuu esiin ja potkaisee Idahon nopeasti maahan.,Un garde imposant s'avance et frappe rapidement Idaho au sol.,Egy nagydarab őr előlép és gyorsan a földre löki Idahót.,Seorang penjaga besar melangkah maju dan dengan cepat menendang Idaho ke tanah.,Una guardia imponente si fa avanti e colpisce rapidamente Idaho a terra.,Een kolossale bewaker stapt naar voren en schopt Idaho snel tegen de grond.,En kraftig vakt trår frem og sparker raskt Idaho til bakken.,Potężny strażnik występuje naprzód i szybko powala Idaho na ziemię.,Um guarda corpulento avança e rapidamente chuta Idaho ao chão.,O gardă uriașă pășește înainte și îl doboară rapid pe Idaho la pământ.,Mohutný strážca vystúpi vpred a rýchlo zrazí Idaha k zemi.,En stor vakt kliver fram och sparkar snabbt Idaho till marken.,İri bir muhafız öne çıkıp hızla Idaho'yu yere deviriyor.,Một lính gác to lớn bước tới và nhanh chóng đá Idaho ngã xuống đất.,A hulking guard steps forward and kicks Idaho to the ground swiftly.,A hulking guard steps forward and kicks Idaho to the ground swiftly.,A hulking guard steps forward and kicks Idaho to the ground swiftly.,A hulking guard steps forward and kicks Idaho to the ground swiftly.,A hulking guard steps forward and kicks Idaho to the ground swiftly.,A hulking guard steps forward and kicks Idaho to the ground swiftly.,A hulking guard steps forward and kicks Idaho to the ground swiftly.,A hulking guard steps forward and kicks Idaho to the ground swiftly.,A hulking guard steps forward and kicks Idaho to the ground swiftly.,A hulking guard steps forward and kicks Idaho to the ground swiftly.,A hulking guard steps forward and kicks Idaho to the ground swiftly.,A hulking guard steps forward and kicks Idaho to the ground swiftly.
Text/2e/text,A shot echoes through the chamber. The screen fades to black.,Chodbou se rozlehne výstřel. Obrazovka potemní.,Et skud giver genlyd gennem kammeret. Skærmen bliver sort.,Ein Schuss hallt durch die Kammer. Der Bildschirm wird schwarz.,Un disparo resuena por la cámara. La pantalla se oscurece.,Laukaus kaikuu kammiossa. Näyttö pimenee.,Un coup de feu résonne dans la chambre. L'écran devient noir.,Egy lövés visszhangzik a kamrában. A képernyő elsötétül.,Sebuah tembakan bergema melalui ruangan. Layar menjadi gelap.,Uno sparo echeggia nella camera. Lo schermo diventa nero.,Een schot weergalmt door de kamer. Het scherm vervaagt naar zwart.,Et skudd gjaller gjennom kammeret. Skjermen falmer til svart.,Strzał odbija się echem po komnacie. Ekran ściemnia się do czerni.,Um tiro ecoa pela câmara. A tela escurece.,Un foc de armă răsună prin cameră. Ecranul se întunecă.,Chodbou sa ozve výstrel. Obrazovka stmavne.,Ett skott ekar genom kammaren. Skärmen tonas till svart.,Odada bir silah sesi yankılanıyor. Ekran karanlığa dönüşüyor.,Một tiếng súng vang vọng qua phòng. Màn hình tối dần.,A shot echoes through the chamber. The screen fades to black.,A shot echoes through the chamber. The screen fades to black.,A shot echoes through the chamber. The screen fades to black.,A shot echoes through the chamber. The screen fades to black.,A shot echoes through the chamber. The screen fades to black.,A shot echoes through the chamber. The screen fades to black.,A shot echoes through the chamber. The screen fades to black.,A shot echoes through the chamber. The screen fades to black.,A shot echoes through the chamber. The screen fades to black.,A shot echoes through the chamber. The screen fades to black.,A shot echoes through the chamber. The screen fades to black.,A shot echoes through the chamber. The screen fades to black.
Text/2f/text,"Idaho, in the name of the potato people of Spud, [color=CHARTREUSE]you're under arrest![/color]","Idaho, ve jménu bramborového lidu Spudu, [color=CHARTREUSE]jsi zatčen![/color]","Idaho, i det kartoffelske folk Spuds navn, [color=CHARTREUSE]er du anholdt![/color]","Idaho, im Namen des Kartoffelvolkes von Spud, [color=CHARTREUSE]bist du verhaftet![/color]","Idaho, en nombre del pueblo patata de Spud, [color=CHARTREUSE]¡estás arrestado![/color]","Idaho, perunakansan nimissä, [color=CHARTREUSE]sinut on pidätetty![/color]","Idaho, au nom du peuple pomme de terre de Spud, [color=CHARTREUSE]tu es en état d'arrestation ![/color]","Idaho, Spud burgonyanépének nevében, [color=CHARTREUSE]le vagy tartóztatva![/color]","Idaho, atas nama rakyat kentang Spud, [color=CHARTREUSE]kamu ditangkap![/color]","Idaho, in nome del popolo patata di Spud, [color=CHARTREUSE]sei in arresto![/color]","Idaho, in naam van het aardappelvolk van Spud, [color=CHARTREUSE]je bent gearresteerd![/color]","Idaho, i navnet til potetfolket i Spud, [color=CHARTREUSE]du er arrestert![/color]","Idaho, w imieniu ziemniaczanego ludu Spud, [color=CHARTREUSE]jesteś aresztowany![/color]","Idaho, em nome do povo batata de Spud, [color=CHARTREUSE]você está preso![/color]","Idaho, în numele poporului cartof din Spud, [color=CHARTREUSE]ești arestat![/color]","Idaho, v mene zemiakového ľudu Spudu, [color=CHARTREUSE]si zatknutý![/color]","Idaho, i namnet av potatisfolket i Spud, [color=CHARTREUSE]är du arresterad![/color]","Idaho, Spud'un patates halkı adına, [color=CHARTREUSE]tutuklusun![/color]","Idaho, nhân danh người dân khoai tây của Spud, [color=CHARTREUSE]ngươi bị bắt![/color]","Idaho, in the name of the potato people of Spud, [color=CHARTREUSE]you're under arrest![/color]","Idaho, in the name of the potato people of Spud, [color=CHARTREUSE]you're under arrest![/color]","Idaho, in the name of the potato people of Spud, [color=CHARTREUSE]you're under arrest![/color]","Idaho, in the name of the potato people of Spud, [color=CHARTREUSE]you're under arrest![/color]","Idaho, in the name of the potato people of Spud, [color=CHARTREUSE]you're under arrest![/color]","Idaho, in the name of the potato people of Spud, [color=CHARTREUSE]you're under arrest![/color]","Idaho, in the name of the potato people of Spud, [color=CHARTREUSE]you're under arrest![/color]","Idaho, in the name of the potato people of Spud, [color=CHARTREUSE]you're under arrest![/color]","Idaho, in the name of the potato people of Spud, [color=CHARTREUSE]you're under arrest![/color]","Idaho, in the name of the potato people of Spud, [color=CHARTREUSE]you're under arrest![/color]","Idaho, in the name of the potato people of Spud, [color=CHARTREUSE]you're under arrest![/color]","Idaho, in the name of the potato people of Spud, [color=CHARTREUSE]you're under arrest![/color]"
Text/30/text,"It's over. The people have spoken. [color=CHARTREUSE]We'll build a new Spud where our roots are in the soil, not in suffering.[/color]","Je konec. Lid promluvil. [color=CHARTREUSE]Vybudujeme nový Spud, kde naše kořeny budou v půdě, ne v utrpení.[/color]","Det er forbi. Folket har talt. [color=CHARTREUSE]Vi vil bygge et nyt Spud, hvor vores rødder er i jorden, ikke i lidelse.[/color]","Es ist vorbei. Das Volk hat gesprochen. [color=CHARTREUSE]Wir werden ein neues Spud aufbauen, wo unsere Wurzeln im Boden sind, nicht im Leid.[/color]","Se acabó. El pueblo ha hablado. [color=CHARTREUSE]Construiremos un nuevo Spud donde nuestras raíces estén en la tierra, no en el sufrimiento.[/color]","Se on ohi. Kansa on puhunut. [color=CHARTREUSE]Rakennamme uuden Spudin, jossa juuremme ovat maassa, eivät kärsimyksessä.[/color]","C'est terminé. Le peuple a parlé. [color=CHARTREUSE]Nous construirons un nouveau Spud où nos racines seront dans le sol, pas dans la souffrance.[/color]","Vége van. A nép beszélt. [color=CHARTREUSE]Új Spudot építünk, ahol gyökereink a földben vannak, nem a szenvedésben.[/color]","Sudah berakhir. Rakyat telah berbicara. [color=CHARTREUSE]Kita akan membangun Spud baru di mana akar kita berada di tanah, bukan dalam penderitaan.[/color]","È finita. Il popolo ha parlato. [color=CHARTREUSE]Costruiremo una nuova Spud dove le nostre radici sono nel terreno, non nella sofferenza.[/color]","Het is voorbij. Het volk heeft gesproken. [color=CHARTREUSE]We zullen een nieuw Spud bouwen waar onze wortels in de grond zijn, niet in lijden.[/color]","Det er over. Folket har talt. [color=CHARTREUSE]Vi vil bygge et nytt Spud der våre røtter er i jorden, ikke i lidelse.[/color]","To koniec. Lud przemówił. [color=CHARTREUSE]Zbudujemy nowe Spud, gdzie nasze korzenie będą w glebie, nie w cierpieniu.[/color]","Acabou. O povo falou. [color=CHARTREUSE]Construiremos uma nova Spud onde nossas raízes estão no solo, não no sofrimento.[/color]","S-a terminat. Poporul a vorbit. [color=CHARTREUSE]Vom construi un nou Spud unde rădăcinile noastre sunt în pământ, nu în suferință.[/color]","Je koniec. Ľud prehovoril. [color=CHARTREUSE]Vybudujeme nový Spud, kde naše korene budú v pôde, nie v utrpení.[/color]","Det är över. Folket har talat. [color=CHARTREUSE]Vi kommer att bygga ett nytt Spud där våra rötter är i jorden, inte i lidande.[/color]","Bitti. Halk konuştu. [color=CHARTREUSE]Köklerimizin toprakta olduğu, acıda değil, yeni bir Spud inşa edeceğiz.[/color]","Đã xong. Người dân đã nói. [color=CHARTREUSE]Chúng ta sẽ xây dựng một Spud mới nơi rễ của chúng ta nằm trong đất, không phải trong đau khổ.[/color]","It's over. The people have spoken. [color=CHARTREUSE]We'll build a new Spud where our roots are in the soil, not in suffering.[/color]","It's over. The people have spoken. [color=CHARTREUSE]We'll build a new Spud where our roots are in the soil, not in suffering.[/color]","It's over. The people have spoken. [color=CHARTREUSE]We'll build a new Spud where our roots are in the soil, not in suffering.[/color]","It's over. The people have spoken. [color=CHARTREUSE]We'll build a new Spud where our roots are in the soil, not in suffering.[/color]","It's over. The people have spoken. [color=CHARTREUSE]We'll build a new Spud where our roots are in the soil, not in suffering.[/color]","It's over. The people have spoken. [color=CHARTREUSE]We'll build a new Spud where our roots are in the soil, not in suffering.[/color]","It's over. The people have spoken. [color=CHARTREUSE]We'll build a new Spud where our roots are in the soil, not in suffering.[/color]","It's over. The people have spoken. [color=CHARTREUSE]We'll build a new Spud where our roots are in the soil, not in suffering.[/color]","It's over. The people have spoken. [color=CHARTREUSE]We'll build a new Spud where our roots are in the soil, not in suffering.[/color]","It's over. The people have spoken. [color=CHARTREUSE]We'll build a new Spud where our roots are in the soil, not in suffering.[/color]","It's over. The people have spoken. [color=CHARTREUSE]We'll build a new Spud where our roots are in the soil, not in suffering.[/color]","It's over. The people have spoken. [color=CHARTREUSE]We'll build a new Spud where our roots are in the soil, not in suffering.[/color]"
Text/31/text,"There will be [color=CRIMSON]no deals, no mercy[/color] for you, Idaho. A tyrant's justice is all you deserve.","Pro tebe [color=CRIMSON]nebudou žádné dohody, žádné slitování[/color], Idaho. Spravedlnost tyrana je vše, co si zasloužíš.","Der vil [color=CRIMSON]ikke være nogen aftaler, ingen nåde[/color] for dig, Idaho. En tyrans retfærdighed er alt, hvad du fortjener.","Es wird [color=CRIMSON]keine Abkommen, keine Gnade[/color] für dich geben, Idaho. Die Gerechtigkeit eines Tyrannen ist alles, was du verdienst.","No habrá [color=CRIMSON]acuerdos, ni misericordia[/color] para ti, Idaho. La justicia de un tirano es todo lo que mereces.","Sinulle [color=CRIMSON]ei tule olemaan sopimuksia, ei armoa[/color], Idaho. Tyrannin oikeus on kaikki, mitä ansaitset.","Il n'y aura [color=CRIMSON]pas d'accords, pas de pitié[/color] pour toi, Idaho. La justice d'un tyran est tout ce que tu mérites.","[color=CRIMSON]Nem lesz alku, nem lesz kegyelem[/color] számodra, Idaho. Egy zsarnok igazságszolgáltatása minden, amit érdemelsz.","[color=CRIMSON]Tidak akan ada kesepakatan, tidak ada belas kasihan[/color] untukmu, Idaho. Keadilan tiran adalah semua yang kau layak dapatkan.","Non ci saranno [color=CRIMSON]accordi, nessuna pietà[/color] per te, Idaho. La giustizia di un tiranno è tutto ciò che meriti.","Er zullen [color=CRIMSON]geen deals, geen genade[/color] voor jou zijn, Idaho. De gerechtigheid van een tiran is alles wat je verdient.","Det vil [color=CRIMSON]ikke være noen avtaler, ingen nåde[/color] for deg, Idaho. En tyranns rettferdighet er alt du fortjener.","Nie będzie [color=CRIMSON]żadnych układów, żadnej litości[/color] dla ciebie, Idaho. Sprawiedliwość tyrana to wszystko, na co zasługujesz.","Não haverá [color=CRIMSON]acordos, nem misericórdia[/color] para você, Idaho. A justiça de um tirano é tudo o que você merece.","Nu vor fi [color=CRIMSON]înțelegeri, nici milă[/color] pentru tine, Idaho. Justiția unui tiran este tot ce meriți.","[color=CRIMSON]Nebudú žiadne dohody, žiadne zľutovanie[/color] pre teba, Idaho. Spravodlivosť tyrana je všetko, čo si zaslúžiš.","Det kommer [color=CRIMSON]inte finnas några avtal, ingen nåd[/color] för dig, Idaho. En tyranns rättvisa är allt du förtjänar.","Senin için [color=CRIMSON]anlaşma yok, merhamet yok[/color], Idaho. Bir tiranın adaleti, hak ettiğin tek şey.","Sẽ [color=CRIMSON]không có thỏa thuận, không có sự khoan dung[/color] cho ngươi, Idaho. Công lý của một bạo chúa là tất cả những gì ngươi đáng được nhận.","There will be [color=CRIMSON]no deals, no mercy[/color] for you, Idaho. A tyrant's justice is all you deserve.","There will be [color=CRIMSON]no deals, no mercy[/color] for you, Idaho. A tyrant's justice is all you deserve.","There will be [color=CRIMSON]no deals, no mercy[/color] for you, Idaho. A tyrant's justice is all you deserve.","There will be [color=CRIMSON]no deals, no mercy[/color] for you, Idaho. A tyrant's justice is all you deserve.","There will be [color=CRIMSON]no deals, no mercy[/color] for you, Idaho. A tyrant's justice is all you deserve.","There will be [color=CRIMSON]no deals, no mercy[/color] for you, Idaho. A tyrant's justice is all you deserve.","There will be [color=CRIMSON]no deals, no mercy[/color] for you, Idaho. A tyrant's justice is all you deserve.","There will be [color=CRIMSON]no deals, no mercy[/color] for you, Idaho. A tyrant's justice is all you deserve.","There will be [color=CRIMSON]no deals, no mercy[/color] for you, Idaho. A tyrant's justice is all you deserve.","There will be [color=CRIMSON]no deals, no mercy[/color] for you, Idaho. A tyrant's justice is all you deserve.","There will be [color=CRIMSON]no deals, no mercy[/color] for you, Idaho. A tyrant's justice is all you deserve.","There will be [color=CRIMSON]no deals, no mercy[/color] for you, Idaho. A tyrant's justice is all you deserve."
